Name,Rating,Rating Count,Address,Verified
"Super Aircondition in Kandivali East, Mumbai",3.7,31,"Panvati CHS, Akurli Road, Kandivali East, Mumbai - 400101, Mahada Road No 2",Not Verified
"Om Refrigeration 2 in Kalyan West, Mumbai",4.5,23,"Chattri Bunglow Road, Kalyan West, Kalyan - 421301, Opp Sandeep Hotel",Not Verified
"Solve Services in Jogeshwari West, Mumbai",3.7,45,"22, Gavdevi Chs, Building No 1, New Link Road,, Jogeshwari West, Mumbai - 400102, Opposite Dheeraj Gaurav Heights",Not Verified
"Snow Sales & Services in Bandra West, Mumbai",4.1,131,"Shop No 7,God Gift Tower, M S Road Off S V Road, Bandra West, Mumbai - 400050, Opposite Lucky Hotel",Not Verified
"S S Cooling System in Prabhadevi, Mumbai",4.7,3,"Shop No 7 Ground Floor God Gift Tower, M S Road, Prabhadevi, Mumbai - 400025",Not Verified
"Unique Cooling Solution in Nalasopara East, Mumbai",5.0,2,"Shop No.6, Shiv Plaza, Pragati Nagar, Nalasopara East, Palghar - 401209, Near Pragati Nagar Police Chowky",Not Verified
"Fridge Cool Sevices in Borivali East, Mumbai",4.1,68,"1/B/106, Vitthal Nagar Building, Borivali East, Mumbai - 400066, Devpada, Near Vitthal Mandir",Verified
"Wefix Enterprises in Mira Road, Mumbai",4.9,176,"Mira Dham Complex, Mira Road, Thane - 401107, Behind Hanuman Mandir, Mira Gaon",Verified
"Prime Enterprise in Mira Road, Mumbai",4.2,442,"Shop No 13, Ground Floor, A1 Building, Shanti Vihar Complex, Station Road, Mira Road, Thane - 401107, Near Railway Station",Verified
"Tammana AIR Cool in Malad East, Mumbai",3.5,2,"Opposite Western Express Highway, Shop No 10mbewadi, Near Gaon Devi Temple, Pushpa Park, Malad East, Mumbai - 400097",Not Verified
"AIR Cool System in Chembur, Mumbai",4.4,33,"Behind Subhiksha Khandhriya Mansion, Chembur, Mumbai - 400071",Not Verified
"Unique Cooling Solution in Nalasopara East, Mumbai",5.0,2,"Shop No.6, Shiv Plaza, Pragati Nagar, Nalasopara East, Palghar - 401209, Near Pragati Nagar Police Chowky",Not Verified
"Om Refrigeration 2 in Kalyan West, Mumbai",4.5,23,"Chattri Bunglow Road, Kalyan West, Kalyan - 421301, Opp Sandeep Hotel",Not Verified
"S S Cooling System in Prabhadevi, Mumbai",4.7,3,"Shop No 7 Ground Floor God Gift Tower, M S Road, Prabhadevi, Mumbai - 400025",Not Verified
"AIR Cool Engineers in Malad West, Mumbai",4.5,204,"Shop No 2, Marve Raod, Malad West, Mumbai - 400095, Jankalyan Nagar",Not Verified
"Fridge Cool Sevices in Tulsiwadi, Mumbai",4.0,119,"Om Building, B 2 B, Room No 814,M P Mills Compaund, M P Mills Compaund, Tulsiwadi, Mumbai - 400034, Maharshtra Nagar",Verified
"AIR Cool Services in Ghatkopar East, Mumbai",4.7,5,"Satyam Shopping Centre, M G Road, Ghatkopar East, Mumbai - 400077",Not Verified
"Fridge Cool Sevices in Borivali East, Mumbai",4.1,68,"1/B/106, Vitthal Nagar Building, Borivali East, Mumbai - 400066, Devpada, Near Vitthal Mandir",Verified
"Wefix Enterprises in Mira Road, Mumbai",4.9,176,"Mira Dham Complex, Mira Road, Thane - 401107, Behind Hanuman Mandir, Mira Gaon",Verified
"Delta Engineering in Jari Mari-sakinaka, Mumbai",3.9,129,"Room No 3, Salimuddin Chawl, K A Road, Jari Mari-sakinaka, Mumbai - 400072, Near Arbi Mohalla",Verified
"I Cool Services in Virar East, Mumbai",3.8,90,"Shop No 1, Ground Floor, Sai Sagar Swapna Sagar CHSL, Phoolpada Road, Virar East, Palghar - 401305, R J Nagar",Verified
"AIR Cool in Antop Hill, Mumbai",3.8,108,"Shop No 9, S M Road, Antop Hill, Mumbai - 400037, Near Dosti Acres",Not Verified
"S S Cool Repairs & Services in Asalfa-ghatkopar West, Mumbai",3.0,12,"Himalaya Society, Asalfa-ghatkopar West, Mumbai - 400084, Near Asalfa Metro Station",Not Verified
"Naaz AIR Condition in Andheri East, Mumbai",3.8,26,"Road No 12, Midc, Andheri East, Mumbai - 400093, Opp Safron Spice Hotel",Verified
"Quick Cool Services in Goregaon West, Mumbai",4.8,351,"Shop No 57, Link Road, Goregaon West, Mumbai - 400104, Bangur Nagar, Near Inorbit Mall",Verified
"Aarvi Aircool Services in Thane West, Mumbai",4.9,5,"Kothimire House, Balkum Pada No 2, Thane West, Thane - 400608, Om Sai Chowk",Not Verified
"Mac Engineers in Andheri West, Mumbai",4.2,136,"Shop No D/5, Plot No 63, Yari Road, Andheri West, Mumbai - 400061, Near D Mart",Verified
"N C Service Center in Mira Road, Mumbai",4.5,35,"Shop No.4 Miral Apt Govind Nagar, Mira Bhayander Road, Mira Road, Thane - 401107, Nr Sai Petrol Pump",Verified
"Bombay Cool in Vile Parle East, Mumbai",3.5,82,"Padris Wadi, Petker Road, Vile Parle East, Mumbai - 400057",Verified
"Vijay Appliances in Bandra East, Mumbai",3.8,20,"Mitalal Neharu Nagar CHs, Building No 1 B K Complex, Bandra East, Mumbai - 400051",Not Verified
"Cool Climate in Thane West, Mumbai",3.5,2,"Shop No.03 , Runwal Tower, Runwal Nagar, Thane West, Thane - 400601, Opp Viviana Mall",Not Verified
"Noman Cool in Taloja, Mumbai",4.4,144,"Shop No. 07, Green View Chs,, Sector 02, Plot No. 2 & 3,, Taloja, Navi Mumbai - 410208, Near Railway Station",Not Verified
"Zip AIR Condition in Santacruz East, Mumbai",3.7,157,"House No 132, John Rodrigous Chawl, Santacruz East, Mumbai - 400029, P & T Colony, Kalina Village",Verified
"Quick Cool in Prabhat Colony-santacruz East, Mumbai",3.7,14,"Jaiswar House, Room No 60, Prabhat Colony-santacruz East, Mumbai - 400055, Near Seva Nagar",Not Verified
"Om Refrigeration in Ambernath, Mumbai",4.6,304,"Shop No. 1941, Datta Kuteer, B-Cabin Road, Ambernath, Thane - 421501, Opposite Bharat Gas",Not Verified
"AIR Floor System in Goregaon West, Mumbai",3.4,124,"Z-153, Kranti Building, Link Road, Goregaon West, Mumbai - 400104, Opposite Goregaon Bus Depot, Bhagat Singh Nagar No 3",Not Verified
"Noman Cool Services in Nerul, Mumbai",3.9,618,"Shop No 5, Plot No C, Satnam Niwas, Sector 20, Nerul, Navi Mumbai - 400706, Near Gaydevi Mandir",Not Verified
"Ss Cool Services in Powai, Mumbai",3.6,15,"Shop No 5,Bhind Gateway Plaza Near Hiranadani Plaza, Hiranadani Garden, Powai, Mumbai - 400076, Near Hiranandani",Not Verified
"S Cool Service in Mumbai Central, Mumbai",5.0,3,"3/3, Floor Grd - 58 , Bhorini Chawl,, 5th Lane Kamatipura , Nagpada, Mumbai Central, Mumbai - 400008",Not Verified
"A.K Cooling System in Borivali West, Mumbai",5.0,3,"Shop No 10, Jupiter Building, Borivali West, Mumbai - 400092, Opp Joggers Park",Not Verified
"Fridge Cool Sevices in Tulsiwadi, Mumbai",4.0,119,"Om Building, B 2 B, Room No 814,M P Mills Compaund, M P Mills Compaund, Tulsiwadi, Mumbai - 400034, Maharshtra Nagar",Verified
"Cool Climate in Thane West, Mumbai",3.5,2,"Shop No.03 , Runwal Tower, Runwal Nagar, Thane West, Thane - 400601, Opp Viviana Mall",Not Verified
"AIR Floor System in Goregaon West, Mumbai",3.4,124,"Z-153, Kranti Building, Link Road, Goregaon West, Mumbai - 400104, Opposite Goregaon Bus Depot, Bhagat Singh Nagar No 3",Not Verified
"Pintu Refrigeration in Vasai East, Mumbai",3.4,109,"Shop No-23,Girnar Heights, Vasai Link Road, Vasai East, Palghar - 401208, Near Dmart",Not Verified
"Quick Cool in Prabhat Colony-santacruz East, Mumbai",3.7,14,"Jaiswar House, Room No 60, Prabhat Colony-santacruz East, Mumbai - 400055, Near Seva Nagar",Not Verified
"AIR Cool Services in Ghatkopar West, Mumbai",4.1,17,"LBS Road, Ghatkopar West, Mumbai - 400086, Near R City Mall",Not Verified
"Cool INDIA Enterprises in Goregaon East, Mumbai",4.9,29,"Devicha Pada Unit No 7, Gen AKV Marg, Goregaon East, Mumbai - 400065",Not Verified
"A.K Cooling System in Borivali West, Mumbai",5.0,3,"Shop No 10, Jupiter Building, Borivali West, Mumbai - 400092, Opp Joggers Park",Not Verified
"Naresh Enterprises in Dadar West, Mumbai",4.5,1,"R-7, Kawli Chawl, Kashinath Dhuru Marg, Dadar West, Mumbai - 400028, Near Kirti College",Not Verified
"Om Refrigeration in Ambernath, Mumbai",4.6,304,"Shop No. 1941, Datta Kuteer, B-Cabin Road, Ambernath, Thane - 421501, Opposite Bharat Gas",Not Verified
"Naresh Enterprises in Dadar West, Mumbai",4.5,1,"R-7, Kawli Chawl, Kashinath Dhuru Marg, Dadar West, Mumbai - 400028, Near Kirti College",Not Verified
"Sharp Cool Services in Goregaon West, Mumbai",4.6,41,"Shop No 14, S V Road, Goregaon West, Mumbai - 400090, Near MTNL Office",Verified
"Sarvadnya Enterprises in Badlapur Ed, Mumbai",3.8,46,"504, Sadguru Deep Co Operative Housing Society, Badlapur Ed, Thane - 421503, Juveli Gaon, Near D K Sadan",Verified
"Ss Cool Services in Powai, Mumbai",3.6,15,"Shop No 5,Bhind Gateway Plaza Near Hiranadani Plaza, Hiranadani Garden, Powai, Mumbai - 400076, Near Hiranandani",Not Verified
"Gurudev Services in Tagore Nagar-vikhroli East, Mumbai",4.9,11,"Shop No 150, Opp Axis Bank ATM, Tagore Nagar-vikhroli East, Mumbai - 400083, Near Shri Prakash",Not Verified
"Call My Engineer (Home Appliances Repair Services) in Dombivli East, Mumbai",4.3,64,"Shop No. 5 Tulsi Vaibhav Society, Nandivali Road, Dombivli East, Thane - 421201, Near Ashok Vatika Society",Not Verified
"Acrepairwala.com in Borivali West, Mumbai",4.0,7,"Room No 1, Dayanand Bhandari Chawl, Shimpoli Road, Borivali West, Mumbai - 400092, Near State Bank Of Hyderabad, Chikuwadi",Not Verified
"Ideal Cooling Point in Kandivali East, Mumbai",4.5,154,"Room No 6, Markhande Singh Society, Gaondevi Road, Kandivali East, Mumbai - 400101, Near Thakur Polytechnic College",Not Verified
"Rudra Enterprise in Sakinaka, Mumbai",4.8,26,"Shop No 8, Dsouza Compound, Kherani Road, Sakinaka, Mumbai - 400072, Opposite S J Studio",Not Verified
"Alok Ac Repair & Electrical Work in Ulhasnagar No 3, Mumbai",4.9,24,"Shop No.1, Mattka Chowk, Ulhasnagar No 3, Thane - 421002, Opp Ordnus Gate",Not Verified
"S S Cool Repairs & Services in Asalfa-ghatkopar West, Mumbai",3.0,12,"Himalaya Society, Asalfa-ghatkopar West, Mumbai - 400084, Near Asalfa Metro Station",Not Verified
"NF AIRCONDITIONER in Dombivli East, Mumbai",3.5,2,"Gala No-3 ,pimpleshawar Buss Stop ,Sagoan, Manpada Road, Dombivli East, Thane - 421201, Opp-Laxmi Hardware",Not Verified
"Unique Cooling Solution in Nalasopara East, Mumbai",5.0,2,"Shop No.6, Shiv Plaza, Pragati Nagar, Nalasopara East, Palghar - 401209, Near Pragati Nagar Police Chowky",Not Verified
"Rudra Enterprise in Sakinaka, Mumbai",4.8,26,"Shop No 8, Dsouza Compound, Kherani Road, Sakinaka, Mumbai - 400072, Opposite S J Studio",Not Verified
"A.K Cooling System in Borivali West, Mumbai",5.0,3,"Shop No 10, Jupiter Building, Borivali West, Mumbai - 400092, Opp Joggers Park",Not Verified
"SHIVRAJ ENTERPRISES in PALAVA CITY, Mumbai",5.0,4,"Shop No 25 Chandesh Niketan Lodha Haven, Nilje, PALAVA CITY, Thane - 421204, Near C. Shiva Ji Maharaj Chowk",Not Verified
"I Cool Services in Virar East, Mumbai",3.8,90,"Shop No 1, Ground Floor, Sai Sagar Swapna Sagar CHSL, Phoolpada Road, Virar East, Palghar - 401305, R J Nagar",Verified
"Naresh Enterprises in Dadar West, Mumbai",4.5,1,"R-7, Kawli Chawl, Kashinath Dhuru Marg, Dadar West, Mumbai - 400028, Near Kirti College",Not Verified
"Ideal Cooling Point in Kandivali East, Mumbai",4.5,154,"Room No 6, Markhande Singh Society, Gaondevi Road, Kandivali East, Mumbai - 400101, Near Thakur Polytechnic College",Not Verified
"Sarvadnya Enterprises in Badlapur Ed, Mumbai",3.8,46,"504, Sadguru Deep Co Operative Housing Society, Badlapur Ed, Thane - 421503, Juveli Gaon, Near D K Sadan",Verified
"Fridge Cool Sevices in Tulsiwadi, Mumbai",4.0,119,"Om Building, B 2 B, Room No 814,M P Mills Compaund, M P Mills Compaund, Tulsiwadi, Mumbai - 400034, Maharshtra Nagar",Verified
"Asian Aircon INDIA in Kopri Colony-Thane East, Mumbai",4.7,21,"44 A Sainath Nagar, Deshmukh Wadi, Kopri Colony-Thane East, Thane - 400603, Behind Anand Tokies",Verified
"Nalanda Inverter  Air Conditioner in Panvel, Mumbai",4.5,22,"Shop No -8, Arihant Plaza ,Plot No -162, Mcch Society, Panvel, Navi Mumbai - 410206, Near Suruchi Hotel",Verified
"Cool Breeze in Airoli, Mumbai",3.5,2,"Sharadha Suman Appartment Shop No.10, Sector 20, Airoli, Navi Mumbai - 400708, Next to Sanjha Chulla Hotel",Not Verified
"Ganesh Electronics in Virar West, Mumbai",4.8,21,"Shop No-31,Shree Shashwat Building, Global City, Virar West, Palghar - 401303, Near Agarwal Life Style",Not Verified
"Arihant Hardware in Virar West, Mumbai",4.7,30,"Shop No 100, Building No 13 , Avenue M,, Global City, Virar West, Palghar - 401303, Near Yazoo Park",Not Verified
Localoye.com in Mumbai,3.5,14,Mumbai - 400001,Not Verified
Housejoy.in in Mumbai,3.8,216,Mumbai - 400001,Not Verified
Samsung INDIA Electronics Pvt Ltd (Customer Care) in Mumbai,3.8,39461,Mumbai,Not Verified
"Croma (R City Mall) in Ghatkopar West, Mumbai",4.2,9271,"C/O Unit G 10, R City Mall, Ground Floor, L B S Marg, Ghatkopar West, Mumbai - 400086, Opposite Presidental Tower, Amrut Nagar",Not Verified
"Croma (Link Square Mall) in Bandra West, Mumbai",3.9,8483,"Plot No 490/491,  Lower Ground Link Square Mall, 33rd Road, Vitthalbhai Patel Road, Bandra West, Mumbai - 400050, Off Linking Road, Near KFC",Not Verified
"Reliance Digital Retail Ltd in Vashi Sector 30a, Mumbai",3.9,7551,"Plot No 39/4 E, Ground Floor, Maithili Signate, Vashi Sector 30a, Navi Mumbai - 400703, Opposite Vashi Railway Station, Besides BSEL Tech Park",Not Verified
Whirlpool INDIA Ltd (Customer Care) in Mumbai,3.8,6806,Mumbai,Not Verified
"Croma in Mulund West, Mumbai",4.0,6551,"Colour Scape, Mall Dhamaal, Dumping Road, Mulund West, Mumbai - 400080, Near Off L B S Marg, Behind Bus Depot, Near Mulund Check Naka, Opposite R Mall",Not Verified
Videocon Industries Ltd (Customer Care) in Mumbai,3.6,6551,Mumbai - 400001,Not Verified
"Croma in Mahavir Nagar-kandivali West, Mumbai",3.9,5994,"Ground Floor B 2, V Souk, Mahavir Nagar-kandivali West, Mumbai - 400067, Next to D Mart, Opposite Kamla Vihar Sports Club, Sector 10",Not Verified
Panasonic INDIA Pvt Ltd (Customer Care) in Mumbai,3.6,5651,Mumbai,Not Verified
"Croma in Fort, Mumbai",4.0,5618,"Shop No 10, Ground Floor, Croma Zip, Elphinstone Building, Veer Nariman Road, Fort, Mumbai - 400001, Near Horniman Circle",Not Verified
Godrej Appliances (Customer Care) in Mumbai,3.8,4844,Mumbai,Not Verified
"Reliance Digital Retail Ltd in Manpada-thane West, Mumbai",3.8,2704,"Shop No 4, Orion Business Park, Ghodbunder Road, Manpada-thane West, Thane - 400607, Near Cinemax Cinema & Cine Wonder Mall",Not Verified
"Reliance Digital Retail Ltd (Korum Mall) in Thane West, Mumbai",3.9,2480,"1st Floor, Korum Mall, Thane West, Thane - 400601, Near Cadbury Company, Off Eastern Express Highway",Not Verified
Hitachi Home & Life Solutions India Ltd (Customer Care) in Mumbai,3.6,2448,Mumbai,Not Verified
"Croma (Phoenix Marketcity Mall) in Kurla West, Mumbai",4.1,1786,"Ug 41 & 42, Phoenix Market City, L B S Marg, Kurla West, Mumbai - 400070",Not Verified
"Reliance Digital Retail Ltd in Ulhasnagar No 3, Mumbai",3.8,1714,"Maharaja Hall, Kalyan Ambernath Road, Ulhasnagar No 3, Thane - 421002, Near Shivaji Chowk, Electronics Market",Not Verified
"Reliance Digital Retail Ltd (Infiniti Mall) in Malad West, Mumbai",3.7,1439,"Shop No SF 203, Second Floor, Infiniti Mall, Link Road, Malad West, Mumbai - 400064, Near D Mart",Not Verified
Haier Appliances INDIA Pvt Ltd (Customer Care) in Mumbai,3.7,1324,Mumbai,Not Verified
"Reliance Digital Retail Ltd in Cbd Belapur, Mumbai",3.9,1321,"Ground & 1st Floor,Times Square, Cbd Belapur, Navi Mumbai - 400614, Sector 15",Not Verified
Mirc Electronics Ltd (Customer Care) in Mumbai,3.7,1217,Mumbai,Not Verified
"Reliance Digital Retail Ltd (Sarvoday Mall) in Kalyan West, Mumbai",3.9,1050,"Shop B, Ground Floor, Sarvodya Mall, Kalyan Sheel Road, Kalyan West, Kalyan - 421301, Beside Raheja Complex, Patri Pool,",Not Verified
"Saii Service Centre in Borivali West, Mumbai",3.5,1028,"Shop No 3, Plot No 57 / 60, Shri Nidhi Bhavan, Borivali West, Mumbai - 400092, Mangal Murti Hospital, Gorai 1",Not Verified
Daikin Airconditioning INDIA Pvt Ltd (Customer Care) in Mumbai,3.5,1005,Mumbai,Not Verified
"Reliance Digital Retail Ltd (Acme Mall) in Khira Nagar-santacruz West, Mumbai",3.7,886,"C/O Acme Mall, 2nd Floor, S V Patel Road, Khira Nagar-santacruz West, Mumbai - 400054",Not Verified
"Reliance Digital (Phoenix Marketcity Mall) in Kurla West, Mumbai",3.7,806,"Lower Ground Floor, G 28-29 Phoenix Marketcity Mall, L B S  Marg, Kurla West, Mumbai - 400070, Near Kamani Bus Stop",Not Verified
Carrier Airconditioning & Refrigeration Pvt Ltd (Customer Care) in Mumbai,3.7,764,Mumbai,Not Verified
"Digi 1 Snehaanjali in Vasai West, Mumbai",3.8,681,"Manikpur Road, Vasai West, Palghar - 401202, Near Augustin School & TBZ Jewellers",Verified
"Perfect Service in Kandivali West, Mumbai",3.4,639,"Shop No 6 Rughani Palace, Sarojini Naidu Road, Kandivali West, Mumbai - 400067, Opposite Bhulabhai Desai Hall",Not Verified
"National Cool Services in Nalasopara East, Mumbai",4.9,560,"Shop No 4, Om Tirupati Apartment, Achole Road, Nalasopara East, Palghar - 401209, Near Raja Shivaji Vidyalaya",Not Verified
"Shree Jain Traders in Samata Nagar-Thane West, Mumbai",4.0,534,"Shop 1-8, Devdaya Park, Samata Nagar-Thane West, Thane - 400606, Opposite Raymonds Company",Not Verified
Eta General Pvt Ltd (Customer Care) in Mumbai,3.6,528,Mumbai,Not Verified
"Synergy Electronics in Goregaon East, Mumbai",4.4,461,"Gala No 18/21/22, Satellite Garden, Film City Road, Goregaon East, Mumbai - 400063, Behind Satelight Tower, Phase 2",Not Verified
"Reliance Digital Retail Ltd (R Mall) in Mulund West, Mumbai",3.7,445,"Shop No G 16, Ground Floor, R Mall, Lbs Marg, Mulund West, Mumbai - 400080, Near Mulund Check Naka",Not Verified
Kitchen Appliances INDIA Ltd (Customer Care) in Mumbai,3.4,405,Mumbai,Not Verified
"Bhatti Motors Pvt Ltd in Nerul, Mumbai",3.8,386,"D/232, TTC Industrial Area, Mumbai Pune Highway, Nerul, Navi Mumbai - 400706, Near Uran Phatta",Verified
"A Z Cooling in Malwani Colony-malad West, Mumbai",3.4,379,"Room No 25 Plot No 60 Gate No 7, Malwani Colony-malad West, Mumbai - 400095, New Collector Compound",Not Verified
"Snow Cool Services in Goregaon West, Mumbai",4.9,360,"Shop No 10, Off Link Road, Goregaon West, Mumbai - 400062, Motilala Nagar",Verified
"LG Electronics INDIA Pvt Ltd in Thane West, Mumbai",3.9,355,"Lgeil Gall No 6 9, S 2, Golden Park Complex, Lbs Marg, Thane West, Thane - 400601, Near Majiwada Hardas Nagar, Panchpakhadi",Not Verified
"Digi 1 Snehaanjali Retail Pvt Ltd in Palghar, Mumbai",3.9,332,"Shop No.1-3, City Point, Mahim Road, Palghar, Palghar - 401404, Opposite National College",Verified
"Gayatri Services in Airoli, Mumbai",4.8,281,"Shop 09 Jalaramashish C Co Operative Housing Society  Plot No E. 86/87, Sector No 09, Airoli, Navi Mumbai - 400708, Near Shamshan Bhomi",Not Verified
"Malaika Appliances Pvt Ltd in Mira Road, Mumbai",3.7,280,"Shop No 210, Mahesh Industrial Premises, Mira Bhayander Road, Mira Road, Thane - 401107, Near Veggies Hotel",Not Verified
TCL (Customer Care) in Mumbai,4.0,274,Mumbai - 400001,Not Verified
"H A Cooling System in Goregaon East, Mumbai",3.4,261,"Shop No 78, Ground Floor, Virani Industrial Estate, New Western Express Highway, Goregaon East, Mumbai - 400063, Near Oberoi Mall",Not Verified
"H S Engineering Works in Malad East, Mumbai",3.8,248,"Sane Rahmat Society Gala No 20, Malad East, Mumbai - 400097, Sanjay Nagar Near Pathanwadi",Not Verified
"Kenstar Service Centre in Andheri East, Mumbai",3.5,226,"Plot No 113/A/B Marol Bhavan, Marol Industrial Estate, Andheri East, Mumbai - 400069, Opposite Mahalaxmi Hotel Lane",Not Verified
"Ezone (Viviana Mall) in Thane West, Mumbai",3.8,215,"Viviana Mall, Unit No Slf 12, Second Floor, Eastern Express Highway, Thane West, Thane - 400601, Next to Jupiter Hospital",Verified
Toshiba INDIA Pvt Ltd (Customer Service) in Mumbai,3.6,203,Mumbai - 400001,Not Verified
"Hi Techno Cool Services in Mira Road, Mumbai",3.9,181,"C-7/401, Shanti Nagar, Mira Road, Thane - 401107, Near Gurudwara",Not Verified
"Climatic Controls in Andheri East, Mumbai",4.9,179,"Unit No 1 & 2, Satguru Industrial Estate, Jija Mata Road, Pump House, Andheri East, Mumbai - 400093, Opp Hanzar Nagar",Not Verified
"Famous Cool Services in Parel, Mumbai",3.3,169,"Shop No 29, Dhenu Building, Dr. Baba Saheb Ambedkar Road, Parel, Mumbai - 400012",Not Verified
"Cool Point in Mira Road, Mumbai",3.6,166,"Shop No 7,Ground Floor, Shiv Pooja Apartment,, Mira Road, Thane - 401107, Ramdev Park",Not Verified
"Shah Cool Sales & Service in Matunga East, Mumbai",4.8,151,"3/13 Bhuta Niwas, Dr Ambedkar Road, Matunga East, Mumbai - 400019, Opposite Amar Petrol Pump, Near Matunga Clinic",Verified
"National Cool Service in Karanjade, Mumbai",4.6,147,"Shop No 5 Sunrise Apartment, Plot No 44, Sector 4, Karanjade, Navi Mumbai - 410206, Near BJP Office, Opposite Shankeshwar Medical",Not Verified
"Reliance Digital Retail Ltd in Mumbai Central, Mumbai",3.9,147,"Central City Mall, Santoshi Mata Durga Co Operative Housing Society, Parekh Holding, Lamington Road, Mumbai Central, Mumbai - 400008, Opposite Shagun Hotel",Not Verified
"F S AC Service Center in Andheri East, Mumbai",3.9,145,"Ground Floor, B-15, Shitladevi Nagar, Ram Rahim Compound, Andheri Kurla Road, Andheri East, Mumbai - 400072, Safed Pul",Not Verified
"Waves Enterprises in Kalyan West, Mumbai",4.6,144,"2nd Floor Jayraj Society,, Prem Auto, Kalyan West, Kalyan - 421301, Near Yogi Dham",Not Verified
"Ashokraaj Enterprises in Bhayandar East, Mumbai",3.9,139,"6 Krishna Villa, B P Road, Bhayandar East, Thane - 401105",Not Verified
"Climate Control in Mahim, Mumbai",3.7,133,"Room No 31, Gomtibai Chawl, Kapad Bazar Road, Mahim, Mumbai - 400016, Behind Shalimar Building & Near Post Office",Not Verified
Kenstar (Customer Care) in Mumbai,3.9,122,Mumbai,Not Verified
"Johnson Controls India Pvt Ltd in Kanjurmarg East, Mumbai",4.4,119,"Jolly Board Tower, D Wing, 7th Floor, Lodha Complex, Kanjurmarg East, Mumbai - 400042",Not Verified
"Raj Air Conditioner in Kopar Khairane Sector 16, Mumbai",5.0,118,"Shop No 29, Laxmi Market, Gurudwara Road, Kopar Khairane Sector 16, Navi Mumbai - 400709, Near Municipal Hospital",Not Verified
"Malaika Appliances Pvt Ltd in Dahisar, Mumbai",3.6,117,"Shop No 1/2/3, Ground Floor, Gulmohar Apartment, Mosquita Nagar, Dahisar, Mumbai - 400068, Near Dahisar Subway, Next to Kotak Mahindra Bank, Sada Vijay Nagar",Not Verified
"Geet Gunjan House Of Electronics in Andheri East, Mumbai",4.1,115,"Shop No 13, Raj Mahal Shopping Centre, M V Road, Andheri East, Mumbai - 400069, Opposite Teli Gali, Near Vishal Hall",Not Verified
"J K Electronics And Appliances in Dombivli East, Mumbai",3.6,114,"Shop No 1 & 2, Shivani Apartment, Tilak Road, Dombivli East, Thane - 421201, Opposite Karwa Hospital",Not Verified
"Samsung Service in Borivali East, Mumbai",4.1,112,"43 Vasant Villa, Kasturba Cross Road, Number 1,, Borivali East, Mumbai - 400066, Chinchpada",Not Verified
"High Cool Services in Andheri East, Mumbai",3.8,110,"Plot No 52/G, Ashiyana Villa, Dena Bank Road, Andheri East, Mumbai - 400059, Near Fire Brigade",Verified
"Cool Point in Powai, Mumbai",4.7,107,"2/B 402 Jai Tarang Chs Ltd, A S Marg, Powai, Mumbai - 400076, Near Powai Police Station",Not Verified
"Star Engineering Co in Mulund West, Mumbai",4.2,106,"C-6-1-1 Dakhshina Co Operative Housing Society, Mulund West, Mumbai - 400080",Not Verified
"Quick Repairs And Services in Bandra West, Mumbai",4.7,103,"Shop No 3 Jayaram Society,, Hill Road, Bandra West, Mumbai - 400050",Not Verified
Koryo (Customer Care) in Mumbai,3.5,97,Mumbai,Not Verified
"LGservice Centre in Malad West, Mumbai",4.5,94,"Shop No 4, Neelkanth Building, Marve Road, Malad West, Mumbai - 400064, Near Indian Overseas Bank",Not Verified
"S S Cooling Services in Kopar Khairane, Mumbai",4.8,92,"Shop No 316, Kopar Khairane, Navi Mumbai - 400709, Near Rajdhani Sweet, Sector 3",Not Verified
"Panasonic Service Center in Borivali West, Mumbai",4.0,92,"Shop No. 52, Aradhna Complex, Borivali West, Mumbai - 400092, Near Ashtavinayak Nagar",Not Verified
"Scb Services Cool in Kashimira-Mira Road, Mumbai",4.9,87,"Shop No 09Bulding No 02,Ideal Enclave, Kashimira-Mira Road, Thane - 401107, Mira Co Operative Industrial Estate",Not Verified
"Sai Kripa Air Conditioning and Electrical Works in Malad West, Mumbai",4.6,86,"Shop No 3, Opp.New Siddhivinayak Building, Malwani Church Marve Road, Malad West, Mumbai - 400064, Sagar Plaza Building",Not Verified
"True View in Airoli, Mumbai",3.8,85,"Shop No.7 Ajanta Sea Breeze, Plot - 8,Secor-14, Airoli, Navi Mumbai - 400708",Not Verified
"Cool Comfort in Mahim, Mumbai",4.0,83,"A/215 Saibaba Building, Bandra Sion Link Road, Mahim, Mumbai - 400016, Opposite ONGC Near Mahim Sation",Verified
"Prime Enterprises in Kandivali West, Mumbai",3.1,83,"Durga Mata Chawl, Link Road, Kandivali West, Mumbai - 400067, Lalji Pada, Sanjay Nagar, Near Sainath Hotel",Verified
"Air Cool Refrigeration in Vashi, Mumbai",4.8,82,"Room No 23, Sector 15, Vashi, Navi Mumbai - 400703",Not Verified
"V Care For Electronics in Vile Parle East, Mumbai",3.5,82,"Shop No 162, Vile Parle East, Mumbai - 400099, Bhajiwadi, Sharishti Nagar, Near Domestic Airport",Not Verified
"Deepak Cool Services in Vashi, Mumbai",4.8,81,"Shop 02, Market Shopping Center, Sector-6, Vashi, Navi Mumbai - 400703, Near Bank Of Maharashtra",Not Verified
"Voltas Ac Service Centre in Ic Colony-borivali West, Mumbai",4.2,81,"89 Arihant Complex, Ic Colony Cross Road No 3, Ic Colony-borivali West, Mumbai - 400103",Not Verified
"Sam Appliances & Electronics in Thane West, Mumbai",4.2,80,"Shop No 1/2, Arihant Apartment, Agiyari Lane, Thane West, Thane - 400601, Near Jambli Naka",Verified
"Perfect Air Cool Engg in Ghatkopar West, Mumbai",3.6,78,"Sl 97/11, Akbar Lala Compound, NSS Road, Ghatkopar West, Mumbai - 400086",Verified
"Cool Corner in Ulhasnagar No 3, Mumbai",3.8,77,"Follower Lane Chowk, Kalyan Ambarnath Road, Ulhasnagar No 3, Thane - 421002, Opposite Royal Kohinoor Apartment",Verified
