Name,Rating,Rating Count,Address,Verified
"Phone Berry in Thane West, Mumbai",5.0,2,"Shop Number 04, Ground Floor,Highstreet Mall, Thane Bhiwandi Road, Thane West, Thane - 400607, Near Tattoo Studio",Not Verified
"Prashant Mobile Shop in Wagle Industrial Estate-Thane West, Mumbai",5.0,2,"Shop No.02,Labhesh Chs, Kamgar Hospitel Road, Wagle Industrial Estate-Thane West, Thane - 400604, Near Ramchandra Nagar No.1",Not Verified
"Shiv Sai Mobicare in Wagle Industrial Estate-Thane West, Mumbai",5.0,2,"Ganeshwar Nagar, Kamgar Hospital Road, Wagle Industrial Estate-Thane West, Thane - 400604, Near Dnyaneshwar Nagar",Not Verified
"Om Sainath Electronics in Louis Wadi-Thane West, Mumbai",5.0,2,"Shop No 3,Santoshi Mata Mandir, Pipe Line Road, Louis Wadi-Thane West, Thane - 400604, Opp Solamki Apt",Not Verified
"Shree Samarth Telecom in Lokmanya Nagar-Thane West, Mumbai",5.0,2,"Shop No 3, Pada No 3,, Lokmanya Nagar-Thane West, Thane - 400606, Near Sainath Hospital,Opp.balaji Apts",Not Verified
"Shree Mahalaxmi Mobile in Thane West, Mumbai",5.0,2,"Shop No.2,Jai Japan Market, Station Road, Thane West, Thane - 400601, Near Prabhat Talkies",Not Verified
"Om Sai Mobile in Thane West, Mumbai",5.0,2,"Shop No 513, Road No 22, Thane West, Thane - 400604, Near Nare Raigad Gali",Not Verified
"Om Sai Mobile in Thane West, Mumbai",5.0,2,"Shop No .2, Road No. 22  Dost APT Kisan Nagar, Thane West, Thane - 400604, Om Hospital",Not Verified
"Shreeji Mobile Solution in Vartak Nagar-Thane West, Mumbai",4.8,2,"Shop No.2 , Shopkeepers Society, Pokhran Road No.1, Vartak Nagar-Thane West, Thane - 400606, Near Vatak Nagar Naka",Not Verified
"Gupta Mobile Shop in Kapurbawdi-Thane West, Mumbai",4.8,2,"Shop No.12, G.b Road, Kapurbawdi-Thane West, Thane - 400607, Near Nalpada",Not Verified
"Dr Simphony in Wagle Industrial Estate-Thane West, Mumbai",4.8,2,"Shop.4,, Dnyneshwar Nagar, Wagle Industrial Estate-Thane West, Thane - 400604, Near Esic Hospital Road",Not Verified
"classic Telecom in Dhokali-Thane West, Mumbai",4.8,2,"Shop No 5,Opp Highland Park, Highland,Kolshet Road, Dhokali-Thane West, Thane - 400607, Near Highland Kailash Nagar,Opp Nagar Sevak Sanjay Bhoir",Not Verified
"Aircon in Savarkar Nagar-Thane West, Mumbai",4.8,2,"Gala No. 1, Shree Sukharta Co-op Hsg, Ganesh House, Road No.33,, Savarkar Nagar-Thane West, Thane - 400606, Near Maharashtra Snack Corner",Not Verified
"Bhavani Mobile Sales & Services in Khopat-Thane West, Mumbai",4.5,2,"Shop No.1,Prabhawati Tower, Pokhran Road No,1, Khopat-Thane West, Thane - 400601, Near Shivsena Shakha",Not Verified
"Lucky Enterprises in Thane West, Mumbai",4.5,2,"Shop No 46, Carnation Building No 10, Phase 6, Gb Road, Thane West, Thane - 400601, Near Brahmand Bus Depo, Dharmacha Pada",Verified
"National Cool Service in Naupada-Thane West, Mumbai",4.5,2,"Shop No 5, Shiv Sankalp Society, Naupada-Thane West, Thane - 400602, Sambhaji Path, Vishnu Nagar",Not Verified
"Ashok Electronics in Thane West, Mumbai",4.5,2,"Shop. No. 4 Chheda Arcade, Station Road, Thane West, Thane - 400601, Near New Ramesh Lodge",Not Verified
"Jai Ambe Telecom in Wagle Industrial Estate-Thane West, Mumbai",4.5,2,"Shop No 10 Jai Ambe Telecom, Road No 22 Sathe Nagar, Wagle Industrial Estate-Thane West, Thane - 400604, Near Santoshi Mata Chawl",Not Verified
"Jituraj Mobile Accessories in Thane West, Mumbai",4.5,2,"Shop No.22, Station Road, Thane West, Thane - 400601, Opposite to CST Bus Depot, Near Platform No.2",Not Verified
"Laxmi Telecom in Vasant Vihar-Thane West, Mumbai",4.3,2,"Shop No.25k, Vasant Vihar Road, Vasant Vihar-Thane West, Thane - 400610, Near kashish photo Studio",Not Verified
"Radha Mobile Collection in Wagle Industrial Estate-thane West, Mumbai",4.3,2,"Shop No. 106, Indira Nagar, Road No. 33,, Wagle Industrial Estate-thane West, Thane - 400604, Opposite Manish General Store",Not Verified
"Savlon Aircon Pvt Ltd in Thane West, Mumbai",4.0,2,"402 Rajhans Nx, Station Road, Thane West, Thane - 400602, Near Goan Devi Bus Depot",Not Verified
"Swastik Enterprises (Office) in Naupada-Thane West, Mumbai",4.0,2,"Shop No 1, Ground Floor, Neelkanth Towers, Ram Maruti Road, Naupada-Thane West, Thane - 400602, Opp Bharat Corparativa Bank",Not Verified
"Sanghavi General Stores in Thane West, Mumbai",4.0,2,"Station Road, Thane West, Thane - 400601, Near Shankar Temple",Not Verified
"Quick Mobiles in Thane West, Mumbai",4.0,2,"Shop No 9,Sanjon Bharti Bldg., Tembi Naka, Thane West, Thane - 400601, Opp Jyoti Book Store",Verified
"Advance Electronics in Thane West, Mumbai",4.0,2,"Shop No 6, Bhagyashri Building, Ram Maruti Road, Thane West, Thane - 400601, Near Dr Katekar",Not Verified
"Washing Solution in Thane West, Mumbai",4.0,2,"Thane West, Thane - 400601",Not Verified
"D S Telesystems in Thane West, Mumbai",4.0,2,"Maatoshri,Shop No 4,Kisan Nagar No 1, Panch Parmeshwar Temple Road, Thane West, Thane - 400601, Near Sanjog Hotel",Not Verified
"Gunjan Electronics in Naupada-Thane West, Mumbai",4.0,2,"3 Sairam Shpg Ctr, Gokhale Rd, Naupada-Thane West, Thane - 400602, Nr Titan Showroom",Not Verified
"Shree Hari Mobile Shop in Naupada-Thane West, Mumbai",4.0,2,"Gaondevi Mandir, Gokhale Road, Naupada-Thane West, Thane - 400602",Not Verified
"Janta Mobile Care in Thane West, Mumbai",4.0,2,"Shop-5, B Cabin Road, Thane West, Thane - 400601, Opp Waman Hari Pethe",Not Verified
"S K Telecom Mobile Rapairing Shop in Thane West, Mumbai",4.0,2,"Shop No.3, Naupada, Thane West, Thane - 400601, Near Thane Railway Station",Not Verified
"Motu Patlu Mobile Shop in Wagle Industrial Estate-Thane West, Mumbai",3.5,2,"Shop No.3,Balaji Heights, Kamgar Nagar Road, Wagle Industrial Estate-Thane West, Thane - 400604, Near Nitin Company, Sambhaji Nagar",Not Verified
"Divya Collection in Thane West, Mumbai",3.5,2,"Shop No 1, Narayan Smruti, Thane West, Thane - 400601, Near R J Thakur College, Veer Savarkar Nagar",Not Verified
"Express Telecom in Rabodi-Thane West, Mumbai",3.5,2,"Shop No 01 Opposite Noor Masjid, Behind Bape Tower, Rabodi-Thane West, Thane - 400601, Near Noor Masjid",Not Verified
"Super Cool Refrigerator in Thane West, Mumbai",3.5,2,"Near R J Thakur Savkar Nagar, Road No 33,, Thane West, Thane - 400604, Near Kamgar Hospital,",Not Verified
"G.n.communication in Savarkar Nagar-Thane West, Mumbai",3.5,2,"22/D-6,dattavijay chs, Veer savarkar nagar road, Savarkar Nagar-Thane West, Thane - 400606, Opp,family dental hub",Not Verified
"Mobile Junction in Lokmanya Nagar-Thane West, Mumbai",3.5,2,"Shop No.10,Swpnavan Society,Lokmanya Nagar, Lokmanya Nagar-Thane West, Thane - 400606, Near Lokmanya Bus Depot",Not Verified
"ICE Berg Refrigeration Sales & Services in Wagle Industrial Estate-Thane West, Mumbai",3.5,2,"Shubh Sagun Apt, Wagle Industrial Estate-Thane West, Thane - 400604, Ramchandra Ngr No 2 Opp Gunijan Tailoring Class Vaiti Wadi",Not Verified
"A M Mobile Care Shop in Thane West, Mumbai",3.0,2,"Shop No 02 Radha Niwas Bldg, Uthalsar Naka, Thane West, Thane - 400601, Opp My Hotel Bar & Resturant",Not Verified
"F. K. Refrigeration in Rabodi-Thane West, Mumbai",3.0,2,"Shop No 1 Nazim Apartment, Shree Rang Road, Rabodi-Thane West, Thane - 400601, Opposite Old Police Station",Not Verified
"Prachi Watch & Music Centre in Thane West, Mumbai",3.0,2,"Ghodbunder Rd, Thane West, Thane - 400601, Beside Aadimaya Mandir, Chitalsar Manpada",Not Verified
"Krishana Electronic Services in Vartak Nagar-Thane West, Mumbai",2.8,2,"Shop No 1, Pokhran Road No.1, Vartak Nagar-Thane West, Thane - 400606, Near Vartak Nagar Police Chowki",Verified
"Cool Care in Thane West, Mumbai",2.8,2,"Heena, Dr,Ansari Road, Thane West, Thane - 400601, Dr,Mujeeb Khan Clinic",Not Verified
"Bright Tech Services in Thane West, Mumbai",2.8,2,"Shop No 25, Swami Vivekanand Sankul, Thane West, Thane - 400610, Near Lokpuram, Opposite Vasundra Society Vasant ViharHiranandani Meadows",Not Verified
"Opal Telesystems in Thane West, Mumbai",2.8,2,"Jai Jawan Market, Above Fish Aquarium, Shivaji Path, Thane West, Thane - 400601, Opp. M. H. School",Not Verified
"Om Electronics in Subhash Nagar-Thane West, Mumbai",2.5,2,"Subhash Nagar, Pokhran Rd No.02, Subhash Nagar-Thane West, Thane - 400606, Opp TCS",Not Verified
"Rajesh Electronics in Vasant Vihar-Thane West, Mumbai",2.5,2,"Anand Bazar, Pokhran Road No 02, Vasant Vihar-Thane West, Thane - 400610, Opposite Parijat Buildg No 01",Not Verified
"Bhavani electronics in Thane West, Mumbai",5.0,1,"Gautam Niwas, Chendani Naka, Station Road, Thane West, Thane - 400601, Opp. Ramesh Lodge",Not Verified
"Bhawani Mobile Sales And Service in Khopat-Thane West, Mumbai",5.0,1,"Shop No.1,Prabhawati Tower, Pokhran Road No.1, Khopat-Thane West, Thane - 400601, Near Shivsena Shakha",Not Verified
"Aditi Mobile Center in Shastri Nagar-Thane West, Mumbai",5.0,1,"Shop No.2,Indise Niwas, Pokhran Road No.1, Shastri Nagar-Thane West, Thane - 400606, Opp,Samrat Villa",Not Verified
"Nilesh Mobile in Thane West, Mumbai",5.0,1,"Dr Gangadhar Nagar,, Road No 33, Wagle Estate,, Thane West, Thane - 400604, Near Kamgar Hospital,",Not Verified
"Max Telecom in Thane West, Mumbai",5.0,1,"Shop.No 4, Ganesh Biulding, Charai, Thane West, Thane - 400601, Near Ganesh Cinema",Not Verified
"Reliable Sales & Services in Thane West, Mumbai",5.0,1,"Jambli Naka, Thane West, Subhas Road, Thane West, Thane - 400601, Opp.vardhman",Not Verified
"M A Enterprises in Thane West, Mumbai",5.0,1,"shop no305 THAKRE APT., LAXMAN PATIL ROAD, Thane West, Thane - 400602, FATIMA SCHOOL",Not Verified
"Kishor Electronics in Thane West, Mumbai",5.0,1,"9, Sai Krupa Apartment, Thane West, Thane - 400602, Near Dr. Karekar Hospital, Behind S T Workshop, Singh Nagar",Not Verified
"Mobile Garage in Thane West, Mumbai",5.0,1,"Shop No.13,Kausatubh Chs, Vishnu Nagar, Thane West, Thane - 400602, Near Gajanan Vadapav,Opp,Achija Hotel",Not Verified
"Allied Radios in Thane West, Mumbai",5.0,1,"Ground Floor, Solanki Bhavan, Chendani Cross Road, Thane West, Thane - 400601, Near Santoshi Mata Hall",Not Verified
"Prema Enterprises in Thane West, Mumbai",5.0,1,"Shop No 2 Mishra Wadi, Pokharan Road No 1, Thane West, Thane - 400601, Near Khopat Bus Stop",Not Verified
"Riya Refrigeration in Thane West, Mumbai",5.0,1,"Masan Wada, Azad Nagar No-1 Hanuman Chowk Castle Mill, Thane West, Thane - 400601, Near Shantiwan Socity",Not Verified
"Jiten Mobile & Computer Services in Thane West, Mumbai",5.0,1,"Shivaji Vidhyalay, Shubhash Nagar, Pokhran Road No 2, Thane West, Thane - 400610, Opp TCS Co.",Not Verified
"Balaji Mobi Care in Wagle Industrial Estate-thane West, Mumbai",5.0,1,"Shop No 1, Pokhran Road, Wagle Industrial Estate-thane West, Thane - 400604, Near Santoshi Mata Temple",Not Verified
"N K Mobiles in Vartak Nagar-Thane West, Mumbai",5.0,1,"Pokhran Road No 1, Vartak Nagar-Thane West, Thane - 400606, Opposite Bank Of Maharashtra, Vartak Nagar  Naka",Not Verified
"R D Aircondition And Refrigeration in Thane West, Mumbai",5.0,1,"Shop No G 48, Jogila Market, Uthalsar Road, Thane West, Thane - 400601, Near Muncipal Corporation Building, Opposite Dargah",Not Verified
"dev sadan dahiya in Vrindavan Society-Thane West, Mumbai",5.0,1,"Vrindavan Road, Vrindavan Society-Thane West, Thane - 400601, Shree Rang Society",Not Verified
"Cooling Solutions in Thane West, Mumbai",5.0,1,"Shop No 3, Rakesh Villa, Thane West, Thane - 400601, Opposite Tjs Bank Ltd",Not Verified
"Sayali Mobile Solution in Savarkar Nagar-Thane West, Mumbai",5.0,1,"Shastri Naka,Vartak Nagar, Thane West, Maharashtra, Pokhran Road, Savarkar Nagar-Thane West, Thane - 400606",Not Verified
"Aalain Mobile Centre in Thane West, Mumbai",5.0,1,"Zaitoon Manzil Shop No.7, 2nd Rabodi, Dr. Ansari Road, Thane West, Thane - 400601, Near Shrirang Police Chowki",Not Verified
"Veer Telecom in Thane West, Mumbai",5.0,1,"Shop No 1, Kaushalya Niwas, Tembi Naka, Thane West, Thane - 400601, Opp Jain Temple, Tembi Naka",Not Verified
"Shree Amit in Thane West, Mumbai",5.0,1,"Thane West, Thane - 400601",Not Verified
"Lucky Electronic in Thane West, Mumbai",5.0,1,"Shop N. 6 Kingal Apartment, Panchganga Road Rabodi, Thane West, Thane - 400601, Near Panchganga",Not Verified
"Fast Service Mobile Store in Thane West, Mumbai",5.0,1,"Bouleward Mall Ground Floor, Nashik Highway, Thane West, Thane - 400601, Near Lodha Complex,Mc Donalad",Not Verified
"Sky Communication in Shastri Nagar-Thane West, Mumbai",5.0,1,"Shastri Nagar, Thane Weast, Pokhran Road No 1, Shastri Nagar-Thane West, Thane - 400606, Aasawari Bldng",Not Verified
"Ocean Tools in Thane West, Mumbai",5.0,1,"Shop No 15, Flora Building, Hiranandani State, Ghodbandar Rd, Thane West, Thane - 400601",Not Verified
"Rupali Telecom in Savarkar Nagar-Thane West, Mumbai",5.0,1,"Shop No D-7, Savarkar Nagar Road, Savarkar Nagar-Thane West, Thane - 400606, Nr Aai Mataji Mandir",Not Verified
"Sweka Enterprises in Thane West, Mumbai",5.0,1,"Shop No 2, Gulab Niwas, Pokhran Road No 1, Thane West, Thane - 400606, Near Yashodhan Nagar, Pada No 2",Not Verified
"Rupali Communication and Xerox in Panch Pakhadi-Thane West, Mumbai",5.0,1,"Shop No 4 Sundaram Society, Naupada Thane West, Panch Pakhadi-Thane West, Thane - 400602, Near Grukul  Society, Near Sundaram Society",Not Verified
"Compcare Services in Thane West, Mumbai",5.0,1,"Shop No.03, Sumitra Chs, Kaju Wadi Road, Thane West, Thane - 400604, Near Maitri Tower",Not Verified
"Sapana Telecom in Thane West, Mumbai",5.0,1,"Jambli Naka Subhash Road, Thane West, Thane - 400601, Near Collctor Office Thane West",Not Verified
"Ashapura Mobile Shop in Savarkar Nagar-thane West, Mumbai",5.0,1,"Shop No 3, Ramchandra Apartment, Lokmany Pada No 2 Road, Savarkar Nagar-thane West, Thane - 400606, Near Suresh Medical",Not Verified
"Shri Mahalaxmi Mobile Sales & Service in Thane West, Mumbai",5.0,1,"4, Pada Number 3, Lokmanya Nagar, K Sankar Set Labadi Marg, Thane West, Thane - 400602",Not Verified
"Cctv Camera Support in Thane West, Mumbai",5.0,1,"Shop No 1, Kanchan Ganga Biulding, Shivaji Path, Thane West, Thane - 400601, Opposite Punjab National Bank",Not Verified
"Krishna Mobile in Thane West, Mumbai",5.0,1,"Shop no 1, Jambli Naka, Thane West, Thane - 400601, Bazar Road",Not Verified
"Shri Ashapura Mobile Shop in Savarkar Nagar-Thane West, Mumbai",5.0,1,"Shop No.1, Savarkar Nagar Road, Savarkar Nagar-Thane West, Thane - 400606, Near Are Thakur School",Not Verified
"Ajay Communication in Vasant Vihar-Thane West, Mumbai",5.0,1,"Shop No.4, Gandhi Nagar road, Vasant Vihar-Thane West, Thane - 400610, Near Ajay Chemist",Not Verified
"R K Telecom in Thane West, Mumbai",5.0,1,"Shop 3, My Fair Building, Thane West, Thane - 400601, Near Malwan Hotel, Sherai",Not Verified
"A B Mobile in Lokmanya Nagar-thane West, Mumbai",5.0,1,"Shop No 1, Plot No 1, D/2, Sidhivinayak Co-Operative Housing Society, Road No 33, Lokmanya Nagar-thane West, Thane - 400606, Near Lokmanaya Bus Stop",Not Verified
"Jeevan Mobile Accessories in Thane West, Mumbai",5.0,1,"Opposite Fire Brigade, New Jawahar Bagh, Thane West, Thane - 400601",Not Verified
"Shree Samarth Telecom in Lokmanya Nagar-thane West, Mumbai",5.0,1,"Shop No 3, Pada No 4, Lokmanya Nagar-thane West, Thane - 400606, Opposite Vitthal Krida Mandal, Pada No 3",Not Verified
"Pari-Nidhi Mobile Stores in Naupada-Thane West, Mumbai",5.0,1,"Shop No 2,Naupada, Gokhale Road, Naupada-Thane West, Thane - 400602, Opposite Rajawat Jewellers",Not Verified
"Climate Control in Thane West, Mumbai",5.0,1,"Room No 503, Gajvarkar Bulding, Thane West, Thane - 400601, Opposite Kalyan Jewellers, Prabhat Nagar, Near M H High School",Not Verified
"Dhanlaxmi Mobile in Lokmanya Nagar-Thane West, Mumbai",5.0,1,"Shivsadan Apt,Shop No.9, Pada No.3,Near Bus Depo, Lokmanya Nagar-Thane West, Thane - 400606, Nr.lokmanya Nagar",Not Verified
"Anukool Aircon Pvt Ltd in Naupada-thane West, Mumbai",5.0,1,"103 Meena Avenue, Sambhaji Marg, Naupada-thane West, Thane - 400602, Vishnu Nagar",Not Verified
"Beauty Electronic in Thane West, Mumbai",5.0,1,"Shop. No. 1, Jai Jawan Market, Shivaji Path, Thane West, Thane - 400601, Opp. M. H. School",Not Verified
"Shree Navkar Mobile in Thane West, Mumbai",5.0,1,"Shop. No. 14, Jai Jawan Market, Shivaji Path, Thane West, Thane - 400601, Opp. M. H. School",Not Verified
"Devendra Yadav (Electrical Contractor) in Thane West, Mumbai",5.0,1,"Thane West, Thane - 400604, Chirag Nagar, Near Viviana Mall",Not Verified
"Look Mobiles. in Thane West, Mumbai",5.0,1,"Shop No 7, Vilasini Building, Station Road, Thane West, Thane - 400601, Near P N B Bank, Shivaji Path",Not Verified
"Shri Sai Telecom in Thane West, Mumbai",5.0,1,"Shop No 6, Matri Plot No 2, Gaodevi Road, Thane West, Thane - 400601, Opposite Rajmal Lakhichand Jewellers",Not Verified
"Mayank Mobile Solution in Thane West, Mumbai",5.0,1,"Shop. No. 3, Dapte House, Lohar Ali, Off Station Road, Thane West, Thane - 400601, Near, Vaishya Sahakari Bank Ltd.",Not Verified
"Sanjivans Refrigeration Services in Thane West, Mumbai",5.0,1,"Shop No 1, Satgharey Building, Station Road, Thane West, Thane - 400601, Behind American Watch Company, Chendani Naka",Not Verified
"Globe Electronics in Thane West, Mumbai",5.0,1,"3, JAI Javan Market, Thane West, Thane - 400601, Bhd Prabhat Cinema",Not Verified
"Jai Ambe Telecom in Lokmanya Nagar-Thane West, Mumbai",5.0,1,"Saidham Co.op Socity, Lokmanya Nagar, Lokmanya Nagar-Thane West, Thane - 400606, Near Old Bus Depot",Not Verified
"Chandu Mobile Shop in Dhokali-Thane West, Mumbai",5.0,1,"Shop No.3, Godbandhar Road, Dhokali-Thane West, Thane - 400607",Not Verified
"Vikky Enterprises in Dhokali-Thane West, Mumbai",5.0,1,"Shop No.6, Kosleth Road Kapurbawdi Thane West, Dhokali-Thane West, Thane - 400607, Near Nandi Baba Mandir",Not Verified
"Sidhivinayak Mobile Service in Thane West, Mumbai",5.0,1,"Nakhwa Compound, Station Road, Thane West, Thane - 400601, Near Thane College",Not Verified
"Satyam Electronics in Wagle Industrial Estate-Thane West, Mumbai",5.0,1,"Shop No 1, Road No 33, Wagle Industrial Estate-Thane West, Thane - 400604, Opposite to Axis Bank Atm",Not Verified
"Patel Mobile Shoppy in Thane West, Mumbai",5.0,1,"Shop no. 1 samarth krupa bldg, Bhiwandi rd, nr. Cidko bus stop, Thane West, Thane - 400601, Opp thane bharat sahakari bank",Not Verified
"Red Apple in Thane West, Mumbai",5.0,1,"Datta Mandir Road, Thane West, Thane - 400601, Near Cidco Bus Stop, Chendani Koliwada",Not Verified
"Evergreen Enterprises in Thane West, Mumbai",5.0,1,"Shop No 01 Ramabai Niwas opposite CIDCO bus Stop, Chendani Koliwada ,, Thane West, Thane - 400601, Near Sai baba mandir",Not Verified
"Care Computer in Thane West, Mumbai",5.0,1,"Shop No 14, Bedekar College Lane, Thane West, Thane - 400601, Near Koli Samaj Hall, Cidco",Not Verified
"Apna mobile repairing centre in Thane West, Mumbai",5.0,1,"Shop no 04 rajdarshan CHSL, Dada Patil wadi station road, Thane West, Thane - 400601, Near railway station",Not Verified
"S P Enterprise in Thane West, Mumbai",4.5,1,"Behind Fish Market Mehar Gandji Stadiym Mahagiri, Thane West, Thane - 400601, Nr Dadoji Kondev Stadium",Not Verified
"Maharashtra Mobile Repairing in Thane West, Mumbai",4.5,1,"Shop No 2, Cheda Arcade, Station Road, Thane West, Thane - 400601, Near Jai Jawan Market",Not Verified
"Vikas Mobiles Electronics in Thane West, Mumbai",4.5,1,"Shop Number 1 Navneet Bharat Shree Sai Park, Lbs Marg, Thane West, Thane - 400601, Opposite Cafe India Hotel",Not Verified
"R N Mobile in Thane West, Mumbai",4.5,1,"Shop No 11, Saddicha Tower,, Azad Nagar No 1 Lbs Marg, Thane West, Thane - 400601, Near Royal Inn Hotel",Not Verified
"Om Sai Electronic in Thane West, Mumbai",4.5,1,"Shop N. 3, Near Kesar Mil Road, Thane West, Thane - 400601, Near Hanuman Temples",Not Verified
"Vora Mobile Zone in Uthalsar-Thane West, Mumbai",4.5,1,"MeenTai Thakrey Chowk,Dighe Udyog Sankul, Castle Mill Road, Uthalsar-Thane West, Mumbai - 400601, Near Castle Mill Chowk",Not Verified
"Jay Ambe Mobile And Service in Thane West, Mumbai",4.5,1,"Shop 3 Shantiben, Near Rutu Park, Thane West, Thane - 400601",Not Verified
"Jiten Mobiles and Computer Services in Subhash Nagar-Thane West, Mumbai",4.5,1,"Shop no. 1 subhash nagar, Pokharan rd no. 2, Subhash Nagar-Thane West, Thane - 400606, Opp tcs",Not Verified
"Vinod Electronic in Thane West, Mumbai",4.5,1,"samaj hall shop 6, Ghodbunder Road, Thane West, Thane - 400601, pokhran road 2 gandhi market",Not Verified
"Balaji Mobi Care in Thane West, Mumbai",4.5,1,"Shop No. 2, Utarsar Road, Thane West, Thane - 400601, Near Sharma Deri Pharm",Not Verified
"Ghawte Mobile in Thane West, Mumbai",4.5,1,"Shop No.3,Wakarwadi Chawl Uthalsar Naka, Uthalsar Naka, Thane West, Thane - 400601, Opp Jalaram Kirana Store",Not Verified
"Amitesh Communication in Thane West, Mumbai",4.5,1,"Shop No 2, Thane West, Thane - 400601",Not Verified
"S3 Telecom in Uthalsar-Thane West, Mumbai",4.5,1,"Shop No-5, Eastern Express Highway, Uthalsar-Thane West, Thane - 400601, Near TMC School No-7",Not Verified
"Cellphone Solution in Vartak Nagar-Thane West, Mumbai",4.5,1,"Pada No.1,, Lokmanya Nagar Road, Vartak Nagar-Thane West, Thane - 400606, Near Maheswari Apartment",Not Verified
"Lucky Enterprises in Rabodi-Thane West, Mumbai",4.5,1,"Shop No.3,Tukaram Park, Saket Road, Rabodi-Thane West, Thane - 400601, Opp,Akash Ganga Chs",Not Verified
"Royal Sales And Services in Savarkar Nagar-Thane West, Mumbai",4.5,1,"Shiva Appartment Shop No 3, Road No.33, Savarkar Nagar-Thane West, Thane - 400606, Behind Veer Hospital",Not Verified
"Blessing Water Supply in Thane West, Mumbai",4.5,1,"Girija Enclave, Near Kaushlya Hospital, Opp Tulja Bhavani Mandir, Ganeshwadi, Panchpakdi, Thane(W), Ganeshwadi, Panchpakhadi, Thane West, Thane - 400601",Not Verified
"Sayed services in Thane West, Mumbai",4.5,1,"Rabodi, Thane West, Thane - 400601",Not Verified
"Chirag Electronic in Jambli Naka-Thane West, Mumbai",4.5,1,"Thana Wala Building, TM Road, Jambli Naka-Thane West, Thane - 400601, Opposite Hanuman Mandir",Not Verified
"Speed Cool Refrigeration in Wagle Industrial Estate-Thane West, Mumbai",4.5,1,"Gala no.16, Road no.16/Z, Wagle Industrial Estate-Thane West, Thane - 400604, Agriculture office",Not Verified
"Shree Siddhivinayak Mobile in Thane West, Mumbai",4.5,1,"Shop. No. 15, Jai Jawan Market, Shivaji Path, Station Road, Thane West, Thane - 400601, Opp. M. H. School",Not Verified
"Siddhivinayak Engineering in Thane West, Mumbai",4.5,1,"Jay Maharastra Indra Nagar, Road No 22, Thane West, Thane - 400604, Near Josh Building",Not Verified
"Mobile Care Centre in Thane West, Mumbai",4.5,1,"Shop No 6 Priyadarshini Chs, M P Road, Thane West, Thane - 400601, Near A K Josh Road",Not Verified
"Shree Sai Tv Service in Thane West, Mumbai",4.5,1,"Shop No. 2, Ram Maruti Nagar, , Balkum Naka, Ram Maruti Nagar, Thane West, Thane - 400608, Near Runwal Gardern City Buyer India, Gate No-2",Not Verified
"Exl Services in Thane West, Mumbai",4.5,1,"Shop No 4, Ghodbunder Road, Thane West, Thane - 400607, Near R Mall",Not Verified
"Perfect  & Cool  Engineers in Naupada-Thane West, Mumbai",4.5,1,"Gajvakra Apt., Gokhale Road, Naupada-Thane West, Thane - 400602",Not Verified
"Hema communication Vodafone Mini Store in Thane West, Mumbai",4.0,1,"Shop no 3, Matri Lily Bldg, Phokhran Road no 2, Thane West, Thane - 400601, Near TCS, Opp Modi Hyundai Service Centre",Not Verified
"Gurupooja mobile shoppee nx in Savarkar Nagar-Thane West, Mumbai",4.0,1,"Shop no.1,swami samarth bldg, Devdaya nagar road, Savarkar Nagar-Thane West, Thane - 400606, Near monginis cake shop",Not Verified
"AC World in Thane West, Mumbai",4.0,1,"Shop No 2 Tawde Niwas, St Depot Road, Thane West, Thane - 400601, Near Thane Janta Bank, Khopat",Not Verified
"Prem Electronics in Khopat-thane West, Mumbai",4.0,1,"Shop No 13, Parijat Building, Khopat-thane West, Thane - 400601, Near St Work Shop, Hans Nagar",Not Verified
"Ananya Mobile Gallery in Thane West, Mumbai",4.0,1,"Subhash Nagar, Pokharan Road No. 2, Thane West, Thane - 400601, Opposite Voltas Main Gate",Not Verified
"S H Refrigeration in Thane West, Mumbai",4.0,1,"A-1 Kamal Apts, M S Road, Thane West, Thane - 400601, Near Highway Darshan",Not Verified
"Shreeji Sales  Service in Wagle Industrial Estate-Thane West, Mumbai",4.0,1,"10/19,sant dnyaneshwar nagar, Kamgar hospital road, Wagle Industrial Estate-Thane West, Thane - 400604, Near ganesh mandir",Not Verified
"Foujiye Electronics in Thane West, Mumbai",4.0,1,"Thane West, Thane - 400601, Indira Nagar",Not Verified
"Aryans Game Zone in Lokmanya Nagar-Thane West, Mumbai",4.0,1,"Gitanjali Apartment, Yashodhan Nagar Road, Lokmanya Nagar-Thane West, Thane - 400606, Near Suresh Medical",Not Verified
"Sai Electronics Sales & Services in Thane West, Mumbai",4.0,1,"Shop. No. 8, Shivaji Path,  Station Road, Thane West, Thane - 400601, Near, Kalyan Jewellers,Jai Jawans Market",Verified
"Sai Communication in Thane West, Mumbai",4.0,1,"Shop No-15, Station Road, Thane West, Thane - 400601, Near Gold Cinema",Not Verified
"Kesari Telecom in Jk Gram-Thane West, Mumbai",4.0,1,"Shop No 1, Ganesh Darshan Bldg, Jk Gram-Thane West, Thane - 400606, Lokmanya Nagar Pada No 4",Not Verified
"JAI Shree Watch & Music Centre in Wagle Industrial Estate-Thane West, Mumbai",4.0,1,"Wagle Industrial Estate-Thane West, Thane - 400604, Ramchandra Nagar No 1, Vaitiwadi",Not Verified
"Jk Telecom in Dhokali-Thane West, Mumbai",3.5,1,"Shop No. 2 Kolshet Road, Highland Residency, Dhokali-Thane West, Thane - 400607, Near Brightland Residency",Not Verified
"Waasifa Telecom in Rabodi-Thane West, Mumbai",3.5,1,"Shop No 1 Postman Building, Shivaji Nagar, Rabodi-Thane West, Thane - 400601, opposite Krishna Appartment",Not Verified
"Hariom Telecom in Ramchandra Nagar-Thane West, Mumbai",3.5,1,"Ramchandra Nagar No.1, Kamgar Hospital Road, Ramchandra Nagar-Thane West, Thane - 400604, Opp,Medicare Hospital",Verified
"Dhanlaxmi Telecom in Thane West, Mumbai",3.5,1,"Shop No 3, Phokhran Rd 1, Thane West, Thane - 400606, Near Sastri Nagar Bus Stop",Not Verified
