Name,Rating,Rating Count,Address,Verified
"Inder Telecom in Mulund West, Mumbai",3.7,17,"Shop No. 26 , Building No A/4, Veena Nagar, Lbs Marg, Mulund West, Mumbai - 400080, Opposite Saraswat Bank",Not Verified
"Jay Malhar Electronics in Near Vartak Nagar Police Station, Mumbai",4.8,3,"Nayantara Apartment, Shop No 2, Lokmanya Nagar Pada No 1, Thane - 400606, Near Vartak Nagar Police Station",Verified
"Croma (R Mall) in Thane West, Mumbai",3.9,3940,"Unit No 6/12, Ground Floor, R Mall, Ghodbunder Road, Thane West, Thane - 400601, Opposite Lawkim Stop",Not Verified
"Reliance Digital Retail Ltd in Manpada-thane West, Mumbai",3.8,2704,"Shop No 4, Orion Business Park, Ghodbunder Road, Manpada-thane West, Thane - 400607, Near Cinemax Cinema & Cine Wonder Mall",Not Verified
"Ccom Telecommunications Pvt Ltd in Thane West, Mumbai",3.7,2121,"F 11,12 /14,1st Flor,Eternity Mall, Thane West, Thane - 400604, Teen Haath Naka",Verified
"Samsung Service Centre in Thane West, Mumbai",3.9,1567,"Shop No 3 & 4, 1st Floor, Commercial Premises, Lokmanya Co Operative Housing Society, Veer Savarkar Marg, Thane West, Thane - 400602, Near Gajananad Maharaj Temple",Not Verified
"B2x Authorised Service Center in Thane West, Mumbai",3.9,1234,"Shop No 4, Dev Prayag Co Operative Housing Society, Bhakti Mandir Road, Thane West, Thane - 400601, Opposite Thanawala Garage, Hariniwas Circle",Not Verified
"Mayur Sales & Service in Mulund West, Mumbai",4.2,51,"Shop No 2, 3 and 4, Jivaram Bhuvan Building, R R T Road, Mulund West, Mumbai - 400080, Opposite Lohana Mahajan Wadi, Bhaji Market",Not Verified
"Royal Mobiles in Mulund West, Mumbai",3.8,8,"A/13, Chandra Darshan, P.K Road, Mulund West, Mumbai - 400080, Next to Jalaram Sweet",Verified
"Cell City Mobile Shop in Airoli, Mumbai",4.1,104,"Shop No 11, Shiv Shankar Apartment, Sector 06, Airoli, Navi Mumbai - 400708, Near Axis Bank",Not Verified
"Om Mobile in Airoli, Mumbai",5.0,23,"Shop No. 7 Mohit Chs, Sector 2., Airoli, Airoli, Navi Mumbai - 400708, Datta Meghe World Academy-Airoli",Not Verified
"Chamunda Electronics in Bhandup West, Mumbai",4.0,18,"Shop No 06, Karia Estate, Station Road, Bhandup West, Mumbai - 400078, Near Municipal Chawl Near Bhandup Plaza",Verified
"H Tech Electronics & Solution in Thakur Village-kandivali East, Mumbai",4.9,7,"Shop No 2, Road No 5., Singh Est, Thakur Village-kandivali East, Mumbai - 400101, Near Samta Nagar Ashram Road",Not Verified
"EL Tech Solutions in Nilje, Mumbai",4.9,10,"Shop No 05 Sana Hills, Shill Mahape Road, Nilje, Thane - 421204, Behind Octroi Naka Salfiya Nagar",Verified
"Om Sai Telecom in Dombivli East, Mumbai",3.7,3,"C/O Prakash Ahire ,Indira Nagar, Shelar Chowk, Kalyan Road,, Dombivli East, Thane - 421201, Near Shelar Chowk",Not Verified
"Divyang Mobile Repair and Services in Dombivli East, Mumbai",4.7,5,"Shop No 3, Dombiwali Station Road, Dombivli East, Thane - 421201, Near By Pooja Jewellers , Mukund Apatment ,",Not Verified
"Ganesh Telecom in Goregaon East, Mumbai",3.8,68,"Shop No. 1, Sumara Compound, Gen Arun Kumar Vaidhya Marg, Goregaon East, Mumbai - 400063, Opposite Bombay 63, Gokuldham, Near Dindoshi Court",Not Verified
"Appliance Repair & Service Centre in Dombivli West, Mumbai",4.0,172,"A-13, 1 St Floor, Shivranajani Co Operative Housing Society, Subhash Road, Dombivli West, Thane - 421202, Navpada",Not Verified
"S R Service Centre in Borivali East, Mumbai",3.8,43,"Dharam Palace, Shantivan, Borivali East, Mumbai - 400066, Near National Park",Not Verified
"Jai Mataji Electronic in Thakur Complex-Kandivali East, Mumbai",4.7,15,"Shop No 13, Vasant Smruti Building, 90 Feet Road, Thakur Complex-Kandivali East, Mumbai - 400101, Near Surbhi Hotel",Verified
"Aastha Electronics in Kandivali East, Mumbai",4.3,7,"Gala No 18, Road No 2, Kandivali East, Mumbai - 400101, Near Thakur College",Not Verified
"Mittal Enterprise in Goregaon East, Mumbai",4.0,157,"Unit No 1, Gujarat Compound, Commerce Centre, Vishweshwar Nagar Road, Goregaon East, Mumbai - 400063, Opposite ACME Amay / Idea Gallery",Not Verified
"Om Sai Electronics in Bhiwandi, Mumbai",5.0,42,"Shop No 2, Arun Niwas, 2nd Naigaon Gayatri Nagar Road, Bhiwandi, Bhiwandi - 421302, Opposite Axis Bank Atm",Verified
"Realme Service Center Shakti Infotech Malad in Malad West, Mumbai",3.9,28,"Shop No 13, 2nd Floor,The Mall Shopping Centre, Station Road, Malad West, Mumbai - 400064, Opposite Malad Railway Station",Verified
"AIR Floor System in Goregaon West, Mumbai",3.4,124,"Z-153, Kranti Building, Link Road, Goregaon West, Mumbai - 400104, Opposite Goregaon Bus Depot, Bhagat Singh Nagar No 3",Not Verified
"N C Service Center in Mira Road, Mumbai",4.5,35,"Shop No.4 Miral Apt Govind Nagar, Mira Bhayander Road, Mira Road, Thane - 401107, Nr Sai Petrol Pump",Verified
"Gaurav Mobile in Mira Road, Mumbai",4.6,24,"Shop No. 6, Building No. 67/68, Sector No.1, Shanti Nagar, Mira Road, Thane - 401107, Opposite T.M.T. Bus Stop",Verified
"Magic Lamp in Mira Road, Mumbai",4.8,33,"Shop No-11,Cine Prime Mall, Beverly Park Kanakia Road, Mira Road, Thane - 401107",Verified
"Endservic in Jogeshwari West, Mumbai",4.0,148,"Shop No 9,Roshan Nagar S R A Chs Ltd BLdg, New Link Road,, Jogeshwari West, Mumbai - 400102, Next to Lashkaria Empress",Verified
"Solutions in Ghatkopar East, Mumbai",4.1,317,"Shop No 1, M G Road, Ghatkopar East, Mumbai - 400077, Near Pooja Hotel, Bhaveshwar Market",Verified
"Solutions in Ghatkopar East, Mumbai",4.1,317,"Shop No 1, M G Road, Ghatkopar East, Mumbai - 400077, Near Pooja Hotel, Bhaveshwar Market",Verified
"Sharp Cool Services in Goregaon West, Mumbai",4.6,41,"Shop No 14, S V Road, Goregaon West, Mumbai - 400090, Near MTNL Office",Verified
"Star Cool INDIA in Andheri West, Mumbai",4.7,415,"Shop No 16, Laxkariya Building, Veera Desai Road, Andheri West, Mumbai - 400058, Near Country Club",Verified
"Quick Cool Services in Goregaon West, Mumbai",4.8,351,"Shop No 57, Link Road, Goregaon West, Mumbai - 400104, Bangur Nagar, Near Inorbit Mall",Verified
"Shaan Mobile in Jogeshwari West, Mumbai",4.3,9,"Shop No 2, Beside Jaffar Bhai Delhi Darbaar, S V Road, Jogeshwari West, Mumbai - 400102, Opp Ghaswalla Dairy",Not Verified
"Krishna Mobile & Laptop Repairing Center in Vashi, Mumbai",4.3,23,"Shop No-192,Harare Fantasia Business Park, Sector 30, Vashi, Navi Mumbai - 400703, Near Vashi Railway Station",Not Verified
"New Choice Centre in Vile Parle East, Mumbai",3.7,17,"Shop No-1/G, Kamdar Shopping Centre, S Khandekar Marg, Vile Parle East, Mumbai - 400057, Near- Girnar Tea",Verified
"Sai Electronics in Govandi East, Mumbai",4.8,14,"Shop No.197/3, Lakhia House, Govandi Station Road, Govandi East, Mumbai - 400088, Opposite Police Station",Not Verified
"Mobile Point Nx & Laptop Point Sales & Services in Vile Parle West, Mumbai",3.8,524,"Shop No 1,  Next to  Alfa 5, Irla Society Road, Vile Parle West, Mumbai - 400056, Near Papillon Hotel",Not Verified
"Om Refrigeration Servicing and Repairing in Kalyan West, Mumbai",3.5,2,"Heena Garden Shop No. 19, D Wing, Pipe Line Road, Kalyan West, Kalyan - 421301, Near Wayale Sports",Not Verified
"Mac Engineers in Andheri West, Mumbai",4.2,136,"Shop No D/5, Plot No 63, Yari Road, Andheri West, Mumbai - 400061, Near D Mart",Verified
"Zaman Telecom in Santacruz East, Mumbai",4.8,13,"Shop No.B-6, Khairunnisa Manzil, Nehru Road, Santacruz East, Mumbai - 400055, Near Vakola Church",Not Verified
"Jamsons Car - Air Condition And Tyres in Vile Parle East, Mumbai",4.6,5,"S. No. 4, Sharda Bhavan, Nehru Road, Vile Parle East, Mumbai - 400057, Opp. Aadarsh Petrol Pump",Verified
"Tech Zone NXT in Kurla West, Mumbai",4.9,76,"Swatantra Sanik Chawl, New Mill Road, Kurla West, Mumbai - 400070, Near Equinox Business Park, Shri Krishna Chowk",Not Verified
"Take Care Services in Santacruz West, Mumbai",5.0,368,"Shop No.3 Gokul Building, S V Road, Santacruz West, Mumbai - 400054, Near Milan Subway Road",Not Verified
"Alif Mobile Telecom Watch And Electronic in Dharavi, Mumbai",4.0,50,"Shop No 04 Chitrakut Building, 90 Feet Road, Dharavi, Mumbai - 400017, Near Citizen Hotel",Not Verified
"A M Choudhary AIR Condition in Seawoods, Mumbai",4.0,13,"Shop No 02, Asmita Residency, Plot No 76, Sector 44A, Seawoods, Navi Mumbai - 400706, Opp Petrop Pump",Not Verified
"Sana Telecom in Dharavi, Mumbai",2.9,8,"B 731/1, Ground Floor, M P Nagar, Dhordwada Road, Dharavi, Mumbai - 400017, Near Qadriya Maszid",Not Verified
"Mobile Solution in Kharghar, Mumbai",4.5,51,"Shop No.5 Haware Sharmik Building, Sector No.20, Kharghar, Navi Mumbai - 410210, Near Shilp Chowk, Before Dominos Pizza",Not Verified
"Hari Om Mobile & Laptop in Kharghar, Mumbai",4.7,69,"Shop No. 12, Plot No. 7, Anmol Plaza, Sector 08, Kharghar, Navi Mumbai - 410210, Near SBI Bank",Verified
"CHARBHUJA TELECOM in Vasai West, Mumbai",4.4,8,"Shop No. 3, Shreeji Apartment,, Pandit Dindayal Nagar, Vasai West, Palghar - 401202, Near Bhaji Market & Ram Rahim Tower",Not Verified
"Kundan Electronics in Antop Hill, Mumbai",3.6,90,"5 Ganesh Society, S M Road, Antop Hill, Mumbai - 400037, Near Antophill Church",Verified
"Vijay Computers in Matunga East, Mumbai",4.2,13,"Shop Number 90/91 L B Shastri Market, L N Road, Matunga East, Mumbai - 400019, Near Matunga Central Station East",Verified
"Shivay Enterprises in Titwala, Mumbai",5.0,8,"Shop No. 1,, Indira Nagar Raod, Titwala, Thane - 421605, Near - Rashtriy Viddyalay",Not Verified
"Vijay Lakshmi Enterprises in Vasai East, Mumbai",4.9,11,"Shop No 4, Opposite Viva Complex, Waliv, Vasai East, Palghar - 401208, Near Shalimar Hotel",Verified
"Comfort Refrigeration in Prabhadevi, Mumbai",5.0,6,"Shop No.S/7, Satyam Building, Ground Floor, B.M Marg, Prabhadevi, Mumbai - 400013, Near Indiabulls 1",Not Verified
"Aadinath Electronics & Mobile Center in Nalasopara East, Mumbai",3.5,15,"Shop No 13, Sangam/B, Gagan Vihar Complex, Achole Cross Road, Nalasopara East, Palghar - 401209, Opposite Amit Dairy",Not Verified
"Shree Krupa Refrigeration in Badlapur, Mumbai",4.6,30,"Chandrawal Society, Ground Floor, D P Road, Badlapur, Thane - 421503, Ghorpade Chauk,Opp Bank Of India",Not Verified
"National Cool Services in Nalasopara East, Mumbai",4.9,560,"Shop No 4, Om Tirupati Apartment, Achole Road, Nalasopara East, Palghar - 401209, Near Raja Shivaji Vidyalaya",Not Verified
"Raj Electronics in Tardeo, Mumbai",3.5,53,"Room No 15, 3rd Floor, 6th Jaykunwar Bhuvan, 8th Khetwadi Lane, Tardeo, Mumbai - 400034",Not Verified
"Bhavesh Electronics in Virar East, Mumbai",4.4,22,"204,Laxman Apartment, Manvelpada Road, Virar East, Palghar - 401305, Near Don Bosco Church",Verified
"Al Azhar Enterprises in Null Bazar, Mumbai",4.3,43,"Shop No 7,Haji Building,, 50 SVP Road, Null Bazar, Null Bazar, Mumbai - 400003, Near Hilal Saloon",Not Verified
"Fridge Cool Sevices in Tulsiwadi, Mumbai",4.0,119,"Om Building, B 2 B, Room No 814,M P Mills Compaund, M P Mills Compaund, Tulsiwadi, Mumbai - 400034, Maharshtra Nagar",Verified
"Fly Infinity Galaxy in Fort, Mumbai",4.6,17,"25, OLYMPUS HOUSE, OPP.CST STATION ROAD STREET, Fort, Mumbai - 400001, NEAR HANDLOOM HOUSE",Verified
"Jyotiba Electronics and Electrical Service in Virar East, Mumbai",4.5,17,"Shop No 2, Jivdani Darshan Apartment, Chandansar Road, Virar East, Palghar - 401305, Near Old Post Office",Not Verified
"Prabhat Mobile Shop in Palghar, Mumbai",3.4,19,"Shop No 2, Bhatt Building, Mahim Road, Palghar, Palghar - 401404, Opposite Manisha Dairy & Paanch Batti",Not Verified
"Dthdeal.in(New DTH Service-Fastest Delievery) in Shahabad, Kurukshetra",4.4,230,"Floor Num -1.319/13, Idgah Road, Shahbad Markanda, Shahabad, Shahbad - 136135",Verified
"Oneplus Exclusive Service Center (Lake City Mall) in Kapurbawdi-thane West, Mumbai",4.1,1228,"Shop No G- 04, Lake City Mall, Kapurbawdi-thane West, Thane - 400607, Near Mcdonalds Near, Goenka International School",Not Verified
"Maple Digital Technology International Pvt Ltd (Viviana Mall) in Thane West, Mumbai",3.9,1190,"G 27, Viviana Mall, Eastern Express Highway, Thane West, Thane - 400606, Next to Jupiter Hospital",Verified
"Paragon Departmental Store in Naupada-thane West, Mumbai",4.1,1128,"Shop No 2 and 3, B Wing, Raunak Arcade, Gokhale Road, Naupada-thane West, Thane - 400602, Near Bank Of Maharashtra",Not Verified
"Oppo Mobile Service Center in Thane West, Mumbai",4.3,1012,"Office Number 308, 3rd Floor, Lodha Supremus, Road No 22, Thane West, Thane - 400604, Next to New Passport Office",Not Verified
"Krish Electronics in Thane West, Mumbai",3.9,954,"Shop No D5, Nandanvan Industrial Estate, Thane West, Thane - 400602, Near Teen Hath Naka, Next to Petrol Pump, Opposite Eternity Mall",Not Verified
"Prudent Telecom Services in Thane West, Mumbai",3.3,762,"Jain Building, Ground Floor, Tembhinaka, Thane West, Thane - 400601, Near Jain Mandir,  Next to Civil Hospital",Verified
"Mobile Care in Panch Pakhadi-thane West, Mumbai",3.8,645,"Shop No 13 Sarovar Darshan Tower, Almeda Road, Panch Pakhadi-thane West, Thane - 400602, Opposite TMC Office Chandanwadi",Not Verified
"Weather Cool Engineers in Naupada-thane West, Mumbai",4.3,608,"Shop No 103 , 1st Floor , Anant Laxmi Charnbers Co-Op Housing Society, Naupada, Naupada-thane West, Thane - 400602",Verified
"Shree Jain Traders in Samata Nagar-Thane West, Mumbai",4.0,534,"Shop 1-8, Devdaya Park, Samata Nagar-Thane West, Thane - 400606, Opposite Raymonds Company",Not Verified
"CTDI in Thane West, Mumbai",3.1,517,"Shop No 2,Gand, Dr Ramesh Pradhan Marg, Thane West, Thane - 400602, Near New English Highschool",Not Verified
"Vishwas Watch And Mobile Centre in Thane West, Mumbai",3.6,404,"Shop No 4 , Sahyadri Hotel, Station Road, Thane West, Thane - 400601, Opposite Thane Platform , Next to Sahyadri Hotel",Not Verified
"LG Electronics INDIA Pvt Ltd in Thane West, Mumbai",3.9,355,"Lgeil Gall No 6 9, S 2, Golden Park Complex, Lbs Marg, Thane West, Thane - 400601, Near Majiwada Hardas Nagar, Panchpakhadi",Not Verified
"Global Telecom in Thane West, Mumbai",3.8,334,"Shop No. 1, Shreenath Villa, Daji Ramchandra Road, Thane West, Thane - 400601, Near Ganesh Talkies and Opposite Sampada Hospital, Charai",Not Verified
"V-Care in Charai-thane West, Mumbai",4.0,325,"Shop No 2, Mahavir Tower, MTNL Exchange Road, Charai-thane West, Thane - 400601, Near Ganesh Talkies, MTNL",Not Verified
"Sony Center in Thane West, Mumbai",4.0,318,"Shop No 1/2/3 , Arihant Towers, Dr Ramesh Pradhan Road, Thane West, Thane - 400601, Behind Sai Kripa Hotel , Talao Pali",Verified
"Global Phones in Panch Pakhadi-Thane West, Mumbai",4.6,302,"Shop No 7, Sita Krupa Building, Gurukul Road, Panch Pakhadi-Thane West, Thane - 400602, Janaseva Bank",Verified
"Mi Dg Mobile Service Shop in Thane West, Mumbai",4.1,286,"Shop No 5, Dev Prayag Society, Bhakti Mandir Road, Thane West, Thane - 400602, Opposite Thanawala Garage, Hari Nivas Circle, Panch Pakhdi",Not Verified
"Mobile Studio in Thane West, Mumbai",3.9,249,"Shop No 2, Raj Darshan Co-op,Housing Society, Station Road, Thane West, Thane - 400602, Near ICICI Atm",Not Verified
"Synergy Camera Centre in Naupada-Thane West, Mumbai",3.6,225,"Shop No 4, Konark Towers, Ghantali Mandir Road, Naupada-Thane West, Thane - 400602, Opposite Sainath Mandir",Not Verified
"Maxcom in Charai-thane West, Mumbai",3.7,218,"Shop No.4, Mahaveer Tower, Edulji Road, Charai-thane West, Thane - 400601, Near Ganesh Cinema, Opposite ICICI Bank",Verified
"Mobile Point in Thane West, Mumbai",3.4,199,"Shop No 6, Chintamani Apartment, St John Baptist School Road, Thane West, Thane - 400601, Charai, Opposite To Dagdi School, Behind Amarpali Hotel",Not Verified
"Canon Care Centre in Charai-thane West, Mumbai",4.0,195,"Ground Floor, Anandvan Society, Hawat Road, Charai-thane West, Thane - 400601, Near Tembhi Naka",Verified
"Doorstep Macbook Repairs and Services in Naupada-thane West, Mumbai",4.8,188,"107,Giri Heaven, L B S Road, Naupada-thane West, Thane - 400602, Near Giriraj Heights Hariniwas Circle",Verified
"A Sai Service Centre in Wagle Industrial Estate-Thane West, Mumbai",4.2,188,"Room No 1, Pakiza Apartment, Wagle Industrial Estate-Thane West, Thane - 400604, Near Masjid, Padwal Nagar",Not Verified
"Flex Krishna Electronics in Thane West, Mumbai",3.7,174,"Shop No 5, Shri Sai Park C Wing, Opp Cafe India Restaurant,Near Meenatai Thakrey Chowk ,, Thane West, Thane - 400601, Castle Mill Naka, Https://krishna-electronics-authorised-service-centre.business.site/",Verified
"Vision Electronics in Thane West, Mumbai",3.8,171,"Shop No 4, Devprayag Co-Operative Housing Society, Bhakti Mandir Road, Thane West, Thane - 400602, Near Saraswat Bank",Not Verified
"Yogesh Services in Thane West, Mumbai",4.0,212,"Gala No 15, Gandhi Nagar Pokhran Road No 2, Thane West, Thane - 400601, Beside Majiwada Voltas Company",Not Verified
"New Vision Electronics in Naupada-thane West, Mumbai",4.0,156,"Shop No 11, Devyani Co-Operative Housing Society, Ramwadi Gokhle Road, Naupada-thane West, Thane - 400602, Near Ice Factory",Not Verified
"B2x Authorised Service Center (Lake City Mall) in Kapurbawdi-thane West, Mumbai",3.5,156,"FA 05/06, Lake City Mall, Ghodbandar Road, Kapurbawdi-thane West, Thane - 400607, Near Big Bazaar, Above McDonald's, Kapurbawdi Junction",Not Verified
"Gooogle Pixel Service Center in Thane West, Mumbai",4.2,155,"F-11, First Mall,Eternity Commercial Complex Mall,, LBS Marg, Thane West, Thane - 400604, Teen Hath Naka",Not Verified
"Ekadant Corporation in Thane West, Mumbai",4.2,140,"Office No 2 1st Flower Akar Long, Ram Maruti Road, Thane West, Thane - 400602, Near Icici Bank  Apposite Vandhana Bus Stand",Verified
"J K Next Mobile World in Naupada-Thane West, Mumbai",3.9,134,"Shop Number 1 & 2 Indrayani Building, Gokhale Road, Naupada-Thane West, Thane - 400602, Opposite Kala Nidhi Showroom",Not Verified
"Universal Services in Thane West, Mumbai",3.5,127,"Thane West, Thane - 400601",Not Verified
"Alankar Digitek in Ramchandra Nagar-Thane West, Mumbai",4.6,124,"Kamgar Hospital Road, Ramchandra Nagar-Thane West, Thane - 400604, Near Ramchandra Gate No 3",Not Verified
"Maxcom Multi Brand Mobile Repairs in Charai-thane West, Mumbai",3.1,123,"Shop No.4, Mahavir Tower, Edulji Road, Charai-thane West, Thane - 400601, Near Ganesh Cinema, Opposite Reliance Fresh, MTNL",Not Verified
"Golden Sales & Services in Naupada-thane West, Mumbai",4.0,122,"Shop No 3, Gokhale Road, Naupada-thane West, Thane - 400602, Near Gamdevi Temple",Not Verified
"Akshay Services in Thane West, Mumbai",4.1,112,"Shop No 9, Sarvoday Mall, Ground Floor, Agra Road, Thane West, Thane - 400601, Near Patri Pul, Near Kalyan Station",Not Verified
"Gionee Care in Thane West, Mumbai",3.1,112,"Shop No. 01, Srinath Villa, Charai, Thane West, Thane - 400601, Opposite Sampada Hospital",Not Verified
"Ilounge in Thane West, Mumbai",4.9,108,"Shop No 3, Maitri Lily, Maitri Garden Complex, Pokhran Road No 2, Thane West, Thane - 400601, Opposite Hyundai Service Centre",Not Verified
"The Photo Shop in Thane West, Mumbai",4.0,108,"Shop No 2, Laxmi Niwas, Vishnu Nagar, Thane West, Thane - 400601, Opposite Thane Bharat Sahkari Bank",Not Verified
"K K Telecom in Naupada-Thane West, Mumbai",4.5,104,"Shop Number 02, Vijay Mahal Building, Gokhale Road, Naupada-Thane West, Thane - 400602, Opposite Tashiq Jwellers",Verified
"Mangalmurti Enterprises in Thane West, Mumbai",3.9,104,"Shop No 1/2 , Chandrama Co-Operative Housing Society, Gadkari Road, Thane West, Thane - 400601, Behind Namaskar Hotel, Besides Cool Camp Ice Cream Parlour, Talavpali",Not Verified
"Orange Mobile Store in Thane West, Mumbai",4.2,103,"Shop No A / 1,Navrang Arcade, Gokhale Road, Thane West, Thane - 400602, Opposite Mcdonald's, Near Thane Station",Not Verified
"A G Enterprises in Thane West, Mumbai",3.6,103,"Shop No.1 , Dattanarayan CHS,, Near Prashant Hotel, Thane West, Thane - 400601, Prashant Hotel, CHarai",Not Verified
"Dry Cool Engineering in Thane West, Mumbai",3.8,91,"Shop No 17 Laxmi Industries, Thane West, Thane - 400601",Not Verified
"Shreeji Mobile in Lokmanya Nagar-Thane West, Mumbai",4.3,90,"Shop No.C-4,Amit Chs,C-wing, Lokmanya Nagar Bus Depo Road, Lokmanya Nagar-Thane West, Thane - 400606, Near Yashodhan Nagar Circle",Not Verified
"Riddhi Siddhi Refrigeration in Thane West, Mumbai",4.6,88,"Room No 2, 2nd Floor, Lake View, Dr Mose Road, Thane West, Thane - 400602, Jalao Pali",Not Verified
"Avl Telecom in Thane West, Mumbai",3.9,88,"Shop No 2, Sharad Kunj, Thane West, Thane - 400602, Behind Hdfc Bank, Beside Nobel Pharmacy, Off Gadkari Road,Talao Pali",Not Verified
"Mehtas Electrotech in Thane West, Mumbai",4.0,80,"Shop No 6 Prestige Garden, Almeida Road, Thane West, Thane - 400602, Near ICICI Bank, Near Nitin Company  Panchpakhadi",Verified
"Fame The Camera Shopee in Naupada-Thane West, Mumbai",4.0,77,"Naupada-Thane West, Thane - 400602",Not Verified
"Phone Pandit in Panch Pakhadi-Thane West, Mumbai",4.6,71,"Shop No 1, Graound Floor Kojagiri Co Operative Ltd, General Arunkumar Vaidy Marg, Panch Pakhadi-Thane West, Thane - 400602, Opposite Utsav Hotal",Not Verified
"Om Services in Thane West, Mumbai",4.4,70,"Shivchhaya, Opposite Ganesh Niwas, Charai, Thane West, Thane - 400602",Not Verified
"Coolmate Appliance Services in Wagle Industrial Estate-Thane West, Mumbai",4.4,65,"ASHA USHA APT ROOM NO 01 SHANTI NAGAR, WAGHELE INDUSTRIAL ESTATE, Wagle Industrial Estate-Thane West, Thane - 400604, THANE WEST",Not Verified
"The Apple Mobile Repairing & More in Thane West, Mumbai",4.0,64,"Shop No.03, JK Apartment, Edilji Road, Thane West, Thane - 400601, Opposite Reliance Fresh",Not Verified
"Ozone Airconditioning & Consultancy in Thane West, Mumbai",4.5,63,"2nd Floor, Chandrama Society,, Naupada, Near Rajawat Jewellers,, Thane West, Thane - 400602, Talaopali, Thane (W) 400 602",Verified
"Shree Ram Phones in Thane West, Mumbai",3.9,57,"Shop No 2, Nikhil Plaza, Tembhi Naka, Thane West, Thane - 400601, Near Civil Hospital",Not Verified
"Idea Gallery in Thane West, Mumbai",4.2,56,"Shop No 1, Ground Floor, Cosmos Residency, Ghodbunder Road, Thane West, Thane - 400604, Near Vijay Nagar, Waghbil Naka",Not Verified
"Shree Sai Electronics in Savarkar Nagar-Thane West, Mumbai",4.2,51,"Shop No 2/3, Panchratna Apartment, Savarkar Nagar-Thane West, Thane - 400606, Near R.J Thakur College",Not Verified
"Hitesh Mobiles & Electronics in Thane West, Mumbai",4.3,50,"Shop No. 4, Trinity Apartment, Beside Ribbons&balloons Cake, Uthalsar Road,, Thane West, Thane - 400601, Opposite Shankar Mandir,",Not Verified
"Icloud Mobile Sales & Services in Kolshet-Thane West, Mumbai",3.7,44,"Shop No 1, Highland Park, Dhokali Road, Kolshet-Thane West, Thane - 400607, Near TJBS Bank",Not Verified
"Dr Handset in Thane West, Mumbai",5.0,39,"Shop Number 4 Tara Nivas Ghantali Naka, Thane West, Thane - 400602, Opposite Satyam Collection",Not Verified
"Nagrik Beauty Palace in Thane West, Mumbai",4.0,39,"Shop No 3, Abhivadan Building, Station Road, Thane West, Thane - 400601, Opposite C K P Bank",Not Verified
"Shree Mobile Gallery & Online Seva in Thane West, Mumbai",4.3,38,"Shop No 2 Tejas Deep, Khima Galli, Thane West, Thane - 400601, Opp State Bank Of India",Not Verified
"Unique Collection in Lokmanya Nagar-Thane West, Mumbai",4.9,37,"Shop No 8, Swapna Co-Operative Housing Society, Road No 22, Lokmanya Nagar-Thane West, Thane - 400606, Near Abhudaya Bank",Not Verified
"The Mobile NX in Vasant Vihar-Thane West, Mumbai",4.1,37,"Shop No 8, Shiv Shilpa Laghu Udyog, Pokharan Road No 2, Vasant Vihar-Thane West, Thane - 400610, Near Hiranandani Meadows",Verified
"R K Mobile Shop in Thane West, Mumbai",3.5,37,"Shop No 2, Lily Apartment, Agyari Lane, Thane West, Thane - 400601, Near Agyari Lane",Not Verified
"Balaji Services in Vasant Vihar-Thane West, Mumbai",4.6,35,"Shop No 77, Shiv Shilp Laghu Udyog, Vasant Vihar Road, Vasant Vihar-Thane West, Thane - 400610, Opposite Lok Upvan",Not Verified
"O K Televisions Pvt Ltd in Thane West, Mumbai",4.0,35,"Shop No 8, Summer Castle, Thane West, Thane - 400601, Castle Mill Naka",Not Verified
"Jk Electronics Nx in Naupada-Thane West, Mumbai",3.8,35,"Shop No 5 Vijay Mahal, Gokhale Road, Naupada-Thane West, Thane - 400602, Near Ice Factory Bus Stop",Verified
"Ganesh Electronics Sales & Service in Thane West, Mumbai",3.7,35,"Shop No 8, Govardhan Dham Society, Khopat Road , Lbs Marg, Thane West, Thane - 400601, Opposite Aakurti S M C",Not Verified
"Om Tv Repair in Thane West, Mumbai",4.8,34,"313, Paradise Tower, Thane East, Naupada, Thane West, Thane - 400601, Next Mc.Donalds",Not Verified
"I Global Services in Kapurbawdi-Thane West, Mumbai",4.7,34,"GA- 27. Ground Floor. Lake City Mall, Kapurbawdi Circle Road, Kapurbawdi-Thane West, Thane - 400607, Mc Donlad",Not Verified
"Jain Traders Nx in Naupada-thane West, Mumbai",3.8,34,"Shop No 5, Tropical Elite, MG Road, Naupada-thane West, Thane - 400602, Opposite Naupada Police Station",Not Verified
"Vijay Sales Service Centre in Thane West, Mumbai",4.2,32,"Nisarg Building Shop No 5,6,7, Thane West, Thane - 400601, R Mall, Manpada",Not Verified
"Ashapura Mobile Shop in Lokmanya Nagar-Thane West, Mumbai",4.3,30,"Shop No 3, Ramchandra Appartment Lok, Yashodhan Nagar Road, Lokmanya Nagar-Thane West, Thane - 400606, Opposite Devendra Industries",Verified
"Home Care Center in Rabodi-thane West, Mumbai",3.9,30,"Dharmanand Appartment,Shop No 5., Panch Ganga Road., Rabodi-thane West, Thane - 400601, Near Rustomjee Rabodi.",Not Verified
"Kunal Telecom in Manpada-thane West, Mumbai",3.3,30,"Shop No 3,, Church Road, Manpada-thane West, Thane - 400607, Ganesh Nagar ,",Not Verified
"Balaji Mobile Solution in Naupada-thane West, Mumbai",3.1,30,"2, Shri Krishna Complex, Dada Patil Wadi Road, Naupada-thane West, Thane - 400602, Opposite Platform No 1",Not Verified
"Mataji Mobile in Thane West, Mumbai",3.3,29,"Shop No-1 nr. canara bank, Kolashet, Thane West, Thane - 400601, sendus baug",Not Verified
"Navkar Telecom in Tembhi Naka-thane West, Mumbai",3.4,28,"Shop No 5, Gautham Labdhi Building, Old Bombay Road, Tembhi Naka-thane West, Thane - 400601, Near Thane Janata Bank",Not Verified
