Name,Rating,Rating Count,Address,Verified
"Akbar Birbal Hair Dressers  & Mens Parlour in Kopar Khairane, Mumbai",3.5,1,"Shop No. 54, Sector 2, Kopar Khairane, Navi Mumbai - 400709, Opp. Shiva Ji Garden",Not Verified
"Shri Mens Salon in Kopar Khairane, Mumbai",3.5,1,"Shop No 751, SS 2, Sector 1, Kopar Khairane, Navi Mumbai - 400709, Near Balaji Garden",Not Verified
"Red Apple Mens Salon in Nerul, Mumbai",3.5,1,"Shop No. 5 Simran Apt., Sector No.28, Nerul, Navi Mumbai - 400706, Near Nerul Gymkhana",Not Verified
"New Look Salon in Ghansoli, Mumbai",3.0,1,"Shop No-3, Ghanshyam Bhavan, Sector-3, Ghansoli, Navi Mumbai - 400701, Near Dargah",Not Verified
"Gitanjali Salon in Kopar Khairane, Mumbai",3.0,1,"Shop no 3, sector 12 D, Station road, Kopar Khairane, Navi Mumbai - 400709, Near bankode lake",Not Verified
"Angels Beauty Parlour in Kopar Khairane, Mumbai",3.0,1,"Shop No 8, Silk Park Blg, Sector No. 12,, Kopar Khairane, Navi Mumbai - 400709, Opp Coprostion Bank",Not Verified
"Venkteshwar Hair Cutting Saloon in Nerul, Mumbai",3.0,1,"Nerul, Navi Mumbai - 400706, Shirvane Market, Sec-1",Not Verified
"A to Z Hair Cutting Salon in Kopar Khairane, Mumbai",2.5,1,"Shop No -1040, Sector-7, Kopar Khairane, Navi Mumbai - 400709, Near Garden",Not Verified
