Name,Rating,Rating Count,Address,Verified
"Time Machine Beauty Solutions Private Limited in Vashi, Mumbai",3.9,12,"Shop No 104, 1st Floor Plot No 17, Plam Beach Galleria, Sector No 19/D,, Vashi, Navi Mumbai - 400703, Near Inox Theatre",Verified
"Studio 13 Family Salon in Sanpada, Mumbai",4.1,178,"Shop No 25, Moraj Residency, Sector 16, Sanpada, Navi Mumbai - 400703, Next to Axis Bank",Not Verified
"Kapils Salon in Vashi, Mumbai",4.5,7432,"Shop No. 149-152, 2 ND Floor , Raghuleela Mall, Station Road, Vashi, Navi Mumbai - 400703, Opp Vashi Railway Station",Verified
"Femina Flaunt Studio Palm Beach Road in Sanpada, Mumbai",5.0,2,"Kshitij, Sector 19, Sanpada, Navi mumbai - 400705, Palm Beach Road",Not Verified
"Impression Salon Hair & Beauty in Vashi, Mumbai",4.5,38,"Shop No 10, Hermes Centre, Plot No 67, Sector 17, Vashi, Navi Mumbai - 400703, Near Mangaldeep Showroom",Not Verified
"Kapils Salon in Vashi, Mumbai",4.5,7432,"Shop No 149 to 152, 2nd Floor Raghuleela Mall, Vashi, Navi Mumbai - 400703, Opp Vashi Railway Station",Verified
"Leenas Beauty And Hair Studio in Vashi, Mumbai",3.8,144,"Office No 208 2nd Floor Satra Plaza, Sector 19 D, Vashi, Navi Mumbai - 400703, Above Mercedes Benz",Verified
"Scissors Noise The Family Salon in Vashi, Mumbai",4.6,625,"Shop No 226 & 227, Ground Floor, Raghuleela Mall,, Sector 30 A, Vashi, Navi Mumbai - 400703, Near Mall Exit",Not Verified
"Kapils Salon (Raghuleela Mall) in Vashi, Mumbai",4.5,7432,"1st Floor, 215 to 217, Raghuleela Mall, Vashi, Navi Mumbai - 400703, Opposite Ashi Railway Station",Verified
"Enrich Salon in Vashi, Mumbai",4.1,1251,"Shop No 32, 33 & 35, Ground Floor, Chhada Cresent Co Op Housing Society Ltd, Plot No 46/55, Vashi, Navi Mumbai - 400703, Sector 17",Verified
"Juice Salon (Inorbit Mall) in Vashi Sector 30a, Mumbai",4.0,907,"C/o Inorbit Mall,Shop No G 19, Vashi Sector 30a, Navi Mumbai - 400703, Next to Station",Verified
"Envi Salon & Spa in Sanpada, Mumbai",4.1,854,"G-34 Inorbit Mall, Ground Floor, Sector - 30, Sanpada, Navi Mumbai - 400703, Nr Vashi Station",Verified
"VLCC Healthcare Ltd in Vashi, Mumbai",3.9,711,"Plot No 41, Palm Beach Road, Vashi, Navi Mumbai - 400703, Near Fortune Hotel, Near Palm Beach Galleria Mall, Sector 19 E",Not Verified
"Scissors Noise The Family Salon in Vashi Sector 30a, Mumbai",4.6,625,"Shop No-191-193, First Floor, Raghuleela Mall, Vashi, Vashi Sector 30a, Navi Mumbai - 400703, Near Vashi Railway Station",Not Verified
"Peacock Salon in Vashi, Mumbai",4.0,504,"Shop No-26-28, Bawa Tower(Big Splash), Sector-17, Vashi, Navi Mumbai - 400703, Near Navratna Hotel",Not Verified
"Budget Beauty (Raghuleela Mall) in Vashi, Mumbai",3.9,450,"Raghuleela Mall, Ground Floor ,Kiosk, Vashi, Navi Mumbai - 400703, Opp. Vashi Railway Station, Sector 30A",Verified
"Hype Tattooz Studio in Vashi, Mumbai",4.9,417,"Vashi, Navi Mumbai - 400703, Opp Railway Station",Verified
"HASHTAG Salon in Vashi, Mumbai",4.9,347,"Shop No 11, MIid Land Chs,, Sector 09, Vashi, Navi Mumbai - 400703, Near Jain Mandir",Verified
"Time Machine Salon And Academy in Vashi, Mumbai",4.5,338,"Shop No 35, Bombay Annexe, Sector 17, Vashi, Navi Mumbai - 400703, Near Mcdonalds",Verified
"Dhruva Spa & Salon in Vashi, Mumbai",4.3,282,"Shop No F-19, Building No F 1, Ground Floor, Sector 4 & 5, Vashi, Navi Mumbai - 400703, Behind Ramdev Hotel",Not Verified
"Lakme Salon in Vashi, Mumbai",3.6,237,"Shop No 9 & 10, Midland Building, Sector 09, Vashi, Navi Mumbai - 400703, Opposite Jain Temple, Near Vashi Depot",Not Verified
"Tattoozzz (Raghuleela Mall) in Vashi, Mumbai",4.9,235,"Shop No.188,Raghuleela Mall, Sector 30 A, Vashi, Navi Mumbai - 400703, Opposite Vashi Railway Station",Not Verified
"Radiance Unisex Salon in Vashi, Mumbai",4.2,222,"Shop No 7/8, Shiv Pooja Building, Plot No 99, Sector 29, Vashi, Navi Mumbai - 400703",Not Verified
"Habibs The Unisex Salon (Raghuleela Mall) in Vashi, Mumbai",3.9,212,"Shop No- 123/125, 2nd Floor, Raghuleela Mall, Sector- 30A, Vashi, Navi Mumbai - 400703, Near Vashi Railway Station",Not Verified
"Spark The Family Salon (Raghuleela Mall) in Vashi, Mumbai",4.2,211,"220/221, Ground Floor, Raghuleela Mall, Vashi, Navi Mumbai - 400703, Opp Railway Station",Not Verified
"Vanamo Spa & Salon in Vashi, Mumbai",3.9,174,"164, 1st Floor, Satara Plaza, Palm Beach Road, Sector 19/A, Vashi, Navi Mumbai - 400703, Next to Citi Center Mall",Not Verified
"Studio 17 Family Salon in Vashi Sector 6, Mumbai",4.7,163,"Shop No.11/12/13, Mansrovar Chs,Plot No.14,Sector 17, Vashi Sector 6, Navi Mumbai - 400703, Near Mc Donald",Not Verified
"Ozone Spa & Salon in Vashi, Mumbai",4.0,139,"Shop No G/10, Haware Infotech Park, Sector 30 A, Vashi, Navi Mumbai - 400703, Near Railway Station, Opposite  Inorbit Mall",Verified
"Leenas Beauty And Hair Care in Vashi, Mumbai",3.9,136,"208, Satra Plaza, Sector 19/D, Palm Beach Road, Vashi, Navi Mumbai - 400703, Above Mercedez Showroom",Verified
"Seventh Sense Spa & Salon in Vashi Sector 17, Mumbai",4.6,123,"C-473, 2nd Floor, Vashi Plaza, Sector 17, Vashi Sector 17, Navi Mumbai - 400703, Opposite HDFC Bank",Not Verified
"Amohaa Spa & Salon in Vashi, Mumbai",3.7,121,"City Centre Mall, 1st Floor, Shop No 44, Palm Beach Road, Vashi, Navi Mumbai - 400703, Sector 19/D",Not Verified
"Kaizo Salon & Spa in Vashi, Mumbai",4.4,108,"Arenja Terrace, Plot No 98, Vashi, Navi Mumbai - 400703, Near Sector 29",Not Verified
"Bhakares Destiny Unisex Salon in Vashi, Mumbai",4.8,105,"Jai Maharashtra Jn 2 Type Appartment Owners Association, Jn2/39 A2, Juhu Nagar, Sector 9, Vashi, Navi Mumbai - 400703, Near Mini Market",Not Verified
"Aura Thai Spa in Sanpada, Mumbai",3.7,94,"103, Fullstop Mall,, Sector 18, Sanpada, Navi Mumbai - 400703, Near Reliance Petrol Pump",Not Verified
"Divine Men & Women Salon in Vashi, Mumbai",4.1,87,"Shop No- 1, Plot No 98, Arenja Terrace, Sector- 29, Vashi, Navi Mumbai - 400703, Near PKC Hospital",Not Verified
"Kyraa Professional in Vashi Sector 28, Mumbai",4.8,70,"Maruti Vihar, Plot No. 65, Shop No. 10, Blue Diamond, Vashi Sector 28, Mumbai - 400703, Near Tilak College",Not Verified
"Riom Spa & Salon in Vashi Sector 19, Mumbai",3.7,71,"Shop No.2, Plot No.3738, Alpex House,, Alpex House, Vashi Sector 19, Navi Mumbai - 400703, Near Satra Plaza",Not Verified
"Dhanvantri Ayur Spa & Salon in Vashi Sector 9, Mumbai",3.7,68,"B 4, Building No F 1, Sector 9, Vashi Sector 9, Navi Mumbai - 400703, Near Sabri Hotel",Not Verified
"Impression Family Beauty Parlour in Vashi, Mumbai",3.9,67,"6 Land View, Vashi, Navi Mumbai - 400703, Near Sector No 14, Trimurti Hotel",Not Verified
"Blossom Family Beauty Salon & Academy (Raghuleela Mall) in Vashi, Mumbai",3.7,67,"Shop No- 142, 2nd Floor, Raghuleela Mall, Sector-30 A, Vashi, Navi Mumbai - 400703, Near Vashi Railway Station",Not Verified
"De Miracle Salon in Vashi, Mumbai",3.6,67,"Shop No 71 Big Splash Building, Station Road, Vashi, Navi Mumbai - 400703, Near Sector 17 Next to Jama Sweets",Not Verified
"Jeevaa The Revitalizing Spa in Vashi, Mumbai",3.7,60,"Shop No 44,Plot No 18,Citi Centre Mall, Sector 19, Palm Beach Road,, Vashi, Navi Mumbai - 400703",Not Verified
"Lavish Spa & Saloon in Vashi, Mumbai",4.3,59,"Plot No 13, Hindvi Bhavan 2 Nd Floor, Sector 1, Vashi, Navi Mumbai - 400703, Near ICICI Bank Ltd",Not Verified
"Kolorz & Kurlz Family Salon in Vashi, Mumbai",4.3,57,"126/127, 2nd Floor, Raghulella Mall, Sector 30/A, Vashi, Navi Mumbai - 400703, Vashi",Not Verified
"Sahar Salon in Vashi, Mumbai",4.8,55,"Shop No 2, Abhimanyu Society, Plot No 102/1, PKG Road, Vashi, Navi Mumbai - 400703, Near Sector No 29",Not Verified
"The Glaze Salon in Vashi Sector 29, Mumbai",4.6,55,"Shop No. 4, Plot No.100, Shiv Pooja CHS., Sector 29, Vashi Sector 29, Navi Mumbai - 400703, Next to Bharat Gas",Not Verified
"Miss Millennium Ladies Beauty Parlour in Vashi, Mumbai",3.9,55,"Shop No 36&37, Bombay Annexe Building, Vashi, Navi Mumbai - 400703, Near Mc Donalds, Sector 17",Not Verified
"Lyn Nail Salon in Vashi, Mumbai",4.5,51,"Inorbit Mall, G20, Ground, Sector 30a, Vashi, Navi Mumbai - 400703",Not Verified
"Hair Looks Salon in Vashi, Mumbai",3.5,48,"Shop No 25, Nirman Vyapar Kendra, Plot No 10, Sector.17, Vashi, Navi Mumbai - 400703, Near Navaratna Hotel",Not Verified
"Omana Salon in Vashi, Mumbai",4.5,47,"Shirin Apartment, Shop No 12,13,14, Vashi, Navi Mumbai - 400703, Near Sector 29",Not Verified
"KBS Spa & Salon in Vashi, Mumbai",4.5,46,"Shop No 01, Mausam Building, Plot No 285, Sector  -28, Vashi, Navi Mumbai - 400703, Near Tilak School, College Of Science and Commerce",Not Verified
"Aristo Spa in Vashi, Mumbai",3.9,45,"C/O Four Points Hotel, 6 to 15, 3rd Floor, Plot No 39/1, Vashi, Navi Mumbai - 400703, Next to Inorbit Mall, Sector No 30a",Not Verified
"Crystal Spa And Salon in Vashi, Mumbai",3.8,42,"Plot No 47, Shop No G 195, Haware Fantasia Business Park, Sector 30 A, Vashi, Navi Mumbai - 400703, Opposite Vashi Railway Station",Not Verified
"Mrunal Ladies Beauty Salon in Sanpada, Mumbai",4.7,41,"Shop No.1,Priyanka Sadan, Sector-10, Sanpada, Navi Mumbai - 400703, Near Ryan Int School,",Not Verified
"Health Glow in Vashi, Mumbai",3.9,39,"F-3, A-4, 2nd Floor, Vaidehi Hotel Building, Sector 9, Vashi, Navi Mumbai - 400703, Above Vaidehi Hotel",Not Verified
"Russh 2 Family Salon in Vashi Sector 17, Mumbai",4.9,38,"Shop 26 Ground Floor Plot 72 Shiv Center, Vashi Turbhe Road, Vashi Sector 17, Navi Mumbai - 400703, Near Arenja Corner",Not Verified
"Stylista Salon in Vashi, Mumbai",4.3,37,"Shop No- 4, Areneja Traces, Plot No- 98, Sector- 29, Vashi, Navi Mumbai - 400703, Near Bhart Gas Shop",Not Verified
"Spark The Family Salon in Sanpada Sector 16, Mumbai",3.7,37,"Shop No.26,27,28, Moraj Residency,Kasturi CHS.,Plot 1, Sector 16, Sanpada Sector 16, Mumbai - 400703, Moraj Residency",Verified
"Spark The Family Salon in Sanpada, Mumbai",3.7,37,"Shop No 26/27/28, Moran Residency, Kasturi CHS, Sanpada, navi mumbai - 400703",Verified
"Turkish Family Salon in Sanpada Sector 8, Mumbai",4.5,32,"SHOP NO.22 & 23,PLOT NO.13 SECTOR NO.8,SHIV TRANI GRALERIA OPP.MILINIUM TOWAR SANPADA, Sanpada Sector 8, Navi Mumbai - 400703, Near Millinium Towar",Not Verified
"Three Star Gents Parlour in Vashi, Mumbai",3.7,32,"Shop No 7, Saulam Society, Palm Beach Road, Vashi, Navi Mumbai - 400703, Near Sector 16 A, Opposite Modern College",Not Verified
"Three Star Gents Parlour in Vashi, Mumbai",3.7,32,"Shop 16 Abhimanyu Plot 102, Vashi, Navi Mumbai - 400703",Not Verified
"Aqua Spa in Vashi, Mumbai",3.2,32,"Shop No 17, Real Tech Park, Vashi, Navi Mumbai - 400703, Near Tunga Hotel, Sector 30 A",Not Verified
"Absolute Salon in Vashi Sector 17, Mumbai",4.1,31,"Shop No-5/90, Chadda Cresent CHS, Plot No-46/55, Abhuday Bank Road, Vashi Sector 17, Navi Mumbai - 400703, Near Woodland Showroom",Not Verified
"Black Pearl Salon in Vashi, Mumbai",4.0,31,"Shop No-5-6, Maple Bldg, Vashi, Navi Mumbai - 400703, Opposite  ICICI Bank, Sector-11/12",Not Verified
"Hard Look Salon in Vashi, Mumbai",3.7,26,"SS TYPE 3/48, Vashi, Navi Mumbai - 400703, Near Abbott Hotel",Not Verified
"Toni & Guy in Vashi, Mumbai",3.6,26,"Ground Floor, Shiv Center Complex, Vashi, Navi Mumbai - 400703, Opposite Airtel Gallery, Arenja Corner, Sector 17",Not Verified
"Kayzils Hair & Beauty Salon in Sanpada, Mumbai",4.2,25,"Shop No 7, Plot No 109, Raj Uday Co Operative Hosuing Society, Palm Beach Road, Sanpada, Navi Mumbai - 400703, Sector 1, Opppsite Vashi Station",Not Verified
"Stylazon Unisex Salon in Vashi Sector 28, Mumbai",4.9,22,"Rajpal Plot Number 62/04, Vashi Sector 28, Mumbai - 400703, Near Blue Diamond",Not Verified
"Rose Salon & Spa in Vashi, Mumbai",3.8,22,"Shop No 32,Keshav Kunj,Plot No 38,39,Sector 30 Opp Sanpada Railways Station, Vashi, Navi Mumbai - 400703, Near Sanpada Railway Station",Not Verified
"Purple Family Salon in Sanpada, Mumbai",3.8,20,"Ashapura Building, Shop No 20,Plot no -3, Palm Beach Road,sector-16, Sanpada, Navi Mumbai - 400703, Near Morage Residency, Sector No 16",Not Verified
"Paradise Saloon & Spa in Vashi, Mumbai",3.4,20,"Shop No 01, Plot No 65, Maruti Vihar Co-opeartive Housing Society, Vashi, Navi Mumbai - 400703, Near Blue Diamond Hotel, Sector No 28",Not Verified
"Refflection Salon Spa Tattoo in Vashi, Mumbai",5.0,19,"Shop No.31 , Ashiana Biulding,, Vashi, Navi Mumbai - 400703, Opposite Mcdonalds, Sector 17",Not Verified
"Ex Salon in Vashi, Mumbai",4.1,19,"Shop No 4, Baba Arcade, Sector 11, Vashi, Navi Mumbai - 400703",Not Verified
"Russh Family Salon in Sanpada, Mumbai",4.7,18,"Shop No 24 Bhumiraj Manor Bldg Sector 14, Sanpada, Navi Mumbai - 400703, Near Buddheshwar Mandir",Not Verified
"7 Seas Family Salon & Spa in Vashi, Mumbai",4.1,18,"Shop No-2/4, Sai Shram CHS. Plot No.66-65, Vashi, navi mumbai - 400703, Near Tilak Collage",Not Verified
"B Lavish Luxurious Family Salon in Vashi, Mumbai",4.9,17,"Grain Merchants Cooperative Housing Society, Ltd., Sector 17, Vashi, Vashi, Navi Mumbai - 400703",Verified
"Botanica Spa & Saloon in Vashi Sector 1, Mumbai",4.3,17,"Plot No 13, Hindvi Bhavan, 2nd Floor, Vashi Sector 1, Navi Mumbai - 400703, Near Yes Bank",Not Verified
"Raybence Spa & Salon in Vashi, Mumbai",3.6,16,"Satra Plaza, Unit No 162,, Sector 19D, Palm Beach Road, Vashi, Navi Mumbai - 400703, 1st Floor, Plot No 19 & 20",Not Verified
"Fusion Spa & Salon in Vashi, Mumbai",3.6,16,"Shop No. 5,Plot No.16, Vashi Infotech Park,Sector 30/A, Sector-30A, Vashi, Navi Mumbai - 400703, Near Vashi Rly Station",Not Verified
"Aanya Family Salon in Vashi Sector 10, Mumbai",4.6,15,"Shop No 16 D Wing, F7 Rainbow Society, Main Road, Vashi Sector 10, Mumbai - 400703, Next to Sbi Atm",Not Verified
"Colors Family Salon in Vashi, Mumbai",3.2,15,"Shop No 26 A, Landmark Co Operative Housing Society, Vashi, Navi Mumbai - 400703, Sector 14",Not Verified
"Fashion Beauty Parlour in Vashi, Mumbai",3.9,14,"Baba Cottage, Kapri Gaon, Sector 26, Vashi, Navi Mumbai - 400703, Near Prabhu Ashish Tower",Not Verified
"Tj Miss Beauty Family Salon in Vashi, Mumbai",3.3,14,"Shno. 28/29, Plot No. 112, Mahavir Dham, C.H.S., Sector 12, Vashi, Navi Mumbai - 400703, Behind Tara Chand Hotel",Not Verified
"Spalazzo Spa N Salon in Vashi Sector 17, Mumbai",4.4,13,"Shop No 26 to 30, Bawa Towers, Vashi Sector 17, Navi Mumbai - 400703",Not Verified
"Copper The Salon in Vashi Sector 17, Mumbai",3.8,13,"Shop No 34 & 35, Shiv Center, Vashi Sector 17, Navi Mumbai - 400703, Near Nerar Arenja Concer , Sector 17",Not Verified
"Asmi Beauty Parlour & Classes in Vashi, Mumbai",3.1,12,"Opp. Siddhivinayak Building, Hanuman Gail Road, Kopri Gaon, Asmi Beauty Parlour & Classes, Sector 26, Vashi, Navi Mumbai - 400703",Not Verified
"Sky Spa & Salon in Vashi Sector 17, Mumbai",4.9,11,"Shop No-445, D-Wing 2nd Floor Vashi Plaza, Vashi Sector 17, navi mumbai - 400703",Not Verified
"Stylish Ladies Beauty Parlour in Vashi, Mumbai",3.2,11,"Shop No-B-2/13,Sector-15 , Opposite Shabari Hotel , Near ICICI Bank ATM, Next to Saroj Clinic , Maha, Vashi, Navi Mumbai - 400703",Not Verified
"Emerald Family Salon & Spa in Sanpada Sector 1, Mumbai",4.1,10,"Sai Raj Complex, Shop No 6, Plot No 103, Sanpada Sector 1, Navi Mumbai - 400703",Not Verified
"G S Glamours Spa Salon in Vashi, Mumbai",4.0,10,"Mahavir Arcade, Shop No 04, Plot No 286, Sector  28, Vashi, Navi Mumbai - 400703, Opposite Kopri Petrol Pump",Not Verified
"ONYX Salon And Spa in Sanpada, Mumbai",3.9,10,"Shop No 2, Ground Floor Plot No -297  Turbhe, Naga Tukaram Patil Marg, Sanpada, Navi Mumbai - 400703, Behind Devis Residency",Not Verified
"Urban Lounge Family Salon in Vashi, Mumbai",3.6,10,"Shop No 29, Shiv Centre Building, Vashi, Navi Mumbai - 400703, Sector 17, Near Airtel Gallery, Arenja Corner",Not Verified
"Sarfaraj Hair Studio in Vashi Sector 17, Mumbai",4.2,9,"Shop No. 26 Mon Bijou Building, Plot No 54, Vashi Sector 17, Navi Mumbai - 400703, Near Abhuday Bank Road",Not Verified
"Farheen Beauty Parlour in Vashi Sector 9, Mumbai",4.4,8,"JN-2/39 A2, Vashi Sector 9, Navi Mumbai - 400703",Not Verified
"Rosy Beauty Salon in Vashi, Mumbai",3.8,8,"Shop No 8, Plot No 98, Arenja Terrace, Vashi, Navi Mumbai - 400703, Sector No 29",Not Verified
"A Super Look 9 in Sanpada, Mumbai",3.7,8,"G/5, Plot 9,The Affairs, Sector 17, Palm Beach Road, Sanpada, Navi Mumbai - 400703, Opposite Bhumiraj Costarica",Not Verified
"Imperia Multi Services in Vashi, Mumbai",4.9,7,"Plot No 14, Millenium Park, Vashi, Navi Mumbai - 400703, Sector 25",Not Verified
"Sonias Salon in Vashi, Mumbai",4.3,7,"Shop No. 16, , Vardhaman Chamber Cooperative Housing Society, Sector 17, Vashi, Vashi, Navi Mumbai - 400703, Near Axis Bank",Not Verified
"Neha Spa & Salon in Mankhurd, Mumbai",4.2,7,"Room No A-7, Jai Jagdambe Chawl, Ghatkopar Mankhurd LInk Road, Virmata Jijabai Bhosale Marg, Mankhurd, Mumbai - 400703, Anna Bhau Sathe Nagar, Shivaji Nagar",Not Verified
"Chic Beauty Parlour And Classes in Vashi, Mumbai",4.1,7,"Jn-1/35, A-1, Sector 9, Vashi, Navi Mumbai - 400703, Behind Shabri Hotel",Not Verified
"Rejuvenate Family Salon & Spa in Sanpada Sector 13, Mumbai",3.5,7,"Shop No C 9, Shah Complex 2, Plot No 3, Sector No 13 Palm Beach Road, Sanpada Sector 13, Navi Mumbai - 400703, Near Body Art Gym & Moraj Residency",Not Verified
"Scissor Sound Family Saloon in Vashi, Mumbai",3.4,7,"Shiv Centre Building,Shop No.26,Plot No.72, Vashi, Navi Mumbai - 400703, Arenja Corner",Not Verified
"Rickys Salon in Sanpada, Mumbai",4.8,6,"Shop No 10/11 Plot No 05 Sai Sager Complex,Near Union Bank,Sec 13,Blush and Blow, Sanpada, Navi Mumbai - 400703, Neway Hospital-Sanpada",Not Verified
"Fleur Salon in Sanpada, Mumbai",4.8,6,"Shop No 15 Seawood Garden, Plot No 4&6, Sanpada, Navi Mumbai - 400703, Near Off Plam Beach Rd",Not Verified
"Mantraa Salon & Spa in Vashi, Mumbai",4.5,6,"Shop No 45, Ground Floor, Satra Plaza, Sector-19D, Palm Beach Road, Vashi, Navi Mumbai - 400703, Behind Mercedes Benz Showroom",Not Verified
"Fiori Spa And Salon in Sanpada, Mumbai",4.4,6,"Shop No.4, The Affairs, Plot No.09, Sector-17, Sanpada, Navi Mumbai - 400703, Near Bhoomiraj Costarica",Not Verified
"Beauty The Salon in Vashi, Mumbai",4.3,6,"Anand Sagar Chs, Sector 17, Vashi, Navi Mumbai - 400703, Opp Fastrack Showroom",Not Verified
"Akhtars Unisex Salon (Raghuleela Mall) in Vashi, Mumbai",4.1,6,"Shop 133, 2nd Floor, Raghuleela Mall, Vashi, Navi Mumbai - 400703, Opposite Vashi Railway Station",Not Verified
"Prince Gents Parlour in Sanpada Sector 8, Mumbai",3.8,6,"Shop No. 20, Shiv Triveni Galleria Building, Sanpada Sector 8, Navi Mumbai - 400703, Opposite Millennium Tower",Not Verified
"Sneha Beauty Parlour & Classes in Vashi, Mumbai",3.6,6,"B 3/ 11, Flat No 13, First Floor, Sector 15, Vashi, Navi Mumbai - 400703, Opposite Shabri Hotel",Not Verified
"Looks Beauty Parlour in Vashi, Mumbai",3.6,6,"Room No A/4, Building No 47, Nakshatra Apartment, J N 1,, Sector 9, Vashi, Navi Mumbai - 400703, Opposite Mini Market",Not Verified
"Style Hub in Vashi, Mumbai",3.5,6,"Shop 17 Rishabh Shopping Centre, Sector-9, Vashi, Navi Mumbai - 400703, Opposite Anjuman Islam School",Not Verified
"Nalini Beauty Parlour & Classes in Vashi Sector 9, Mumbai",4.8,5,"JN-1/15/B-4, Vashi Sector 9, Navi Mumbai - 400703, St. Mary's School",Not Verified
"Beautysecrets Family Salon in Sanpada, Mumbai",4.7,5,"Shop No 6,  Plot No. 8A-8B,, Sanpada, Navi Mumbai - 400703, Near HDFC Bank",Not Verified
"Posh Cuts And Colour in Vashi Sector 17, Mumbai",4.5,5,"Shop No 19, Plot No 27, Ashiyana Building, Vashi Sector 17, Navi Mumbai - 400703",Not Verified
"Shimmer N Shine in Vashi, Mumbai",4.5,5,"Jn-1/35, B-4, Kailash Apartment, Sector 9, Vashi, Navi Mumbai - 400703, Behind Shabri Hotel",Not Verified
"R K Mens Parlour in Turbhe, Mumbai",4.5,5,"Shop No 755, Hanuman Nagar,  Fizer Road, Turbhe, Navi Mumbai - 400703, Near Turbhe Naka  Near Amit Palace",Not Verified
"Glamour Beauty Parlour in Vashi, Mumbai",4.4,5,"J N  2, 41/B 4,Jai Maharashtra Association, Sector 9, Vashi, Navi Mumbai - 400703, Near Ram Prasad Jewellers",Not Verified
"Lola Family Salon & Spa in Sanpada, Mumbai",4.2,5,"Shop No 7/8, Even Palace,, Sanpada, Navi Mumbai - 400703, Near Jaypuriyar School, Sector No 16/A, Plot No 16",Not Verified
"Perfect Extensions in Kopar Khairane, Mumbai",4.9,10,"Shop No 32,Fam CHS,Sector 11, Sector 19, Kopar Khairane, Navi Mumbai - 400709, (Also @ Vashi Sector 30 A,Near Vashi Station)",Verified
"Golden Crown Family Salon in Kopar Khairane, Mumbai",4.8,19,"Shop No -3 ,Plot No -1 New Satara, Sector-14, Kopar Khairane, navi mumbai - 400709, Near Gahlot Collage",Not Verified
"Lakme Salon in Kopar Khairane, Mumbai",4.0,291,"Shop No 6 , Plot No 1& 2 , Pranjee Marina, Kopar Khairane Vashi Road, Kopar Khairane, Navi Mumbai - 400709, Near Ccd , Sector No 13",Verified
"Colors Unisex Salon & Beauty Care in Kopar Khairane, Mumbai",3.8,65,"Mahavir Shraddha Building, Shop No 12, Kopar Khairane, Navi Mumbai - 400709, Opposite Dmart, Sector No 14",Not Verified
"Birchwood Eternal Beauty Lounge in Kopar Khairane, Mumbai",4.7,63,"Shop 5, Ashirwad Chs, Sector 16, Kopar Khairane, Navi Mumbai - 400709, Near Municipal Hospital",Not Verified
"Spark The Family Salon in Kopar Khairane, Mumbai",3.7,43,"Shop No 4 & 5, Plot No 16, Lotus Apartment, Sector No 14, Kopar Khairane, Navi Mumbai - 400709, Opposite D Mart",Not Verified
"Sweet 16 Ladies Salon in Kopar Khairane, Mumbai",4.7,38,"Shop No 4, Plot No 45, Riveria Co Operative Housing Society, Kopar Khairane, Navi Mumbai - 400709, Behind Reliance Foundation School, Sector 14",Not Verified
"Jagujar Studio in Kopar Khairane Sector 11, Mumbai",4.4,24,"Shop No.4,Plot No.26, Mayur Park Building, Kopar Khairane Sector 11, Navi Mumbai - 400709, Near Nect to Azad Maidan",Not Verified
"Qtangles Hair And Beauty Studio in Kopar Khairane, Mumbai",4.6,23,"Shop No 33, Fam Co-Operative Housing Society, Bonkode Village Marg, Kopar Khairane, Navi Mumbai - 400709, Next to KK Mithaiwala, Sector No 11",Not Verified
"Dnova Beauty Salon in Nerul, Mumbai",4.2,23,"Suyansh Apartment ,Shop No 1 & 2, Nerul, Navi Mumbai - 400706, Sector 21",Not Verified
"Hair Express in Kopar Khairane, Mumbai",4.8,16,"Shop No 5 Monalisa Palace Plot No 72, Sector No.5, Kopar Khairane, Navi Mumbai - 400709, Near Central Bank Of India",Not Verified
"Ecstasy Beauty Parlour in Kopar Khairane, Mumbai",4.2,16,"Shop No -5, Sector-16, Kopar Khairane, Navi Mumbai - 400709",Not Verified
"Shears The Family Salon in Kopar Khairane Sector 14, Mumbai",3.8,16,"Shop No 9, Plot No 14,Krishna Tower, Kopar Khairane Sector 14, Navi Mumbai - 400709, Near D Mart",Not Verified
"Style Me Beauty Salon in Kopar Khairane Sector 15, Mumbai",4.1,15,"Orchid Co Operative Housing Society, Shop No 13, Plot No 56, Kopar Khairane Sector 15, Navi Mumbai - 400709",Not Verified
"Vishesh Beauty Parlour in Ulwe, Mumbai",4.4,12,"Shop No 3, Gauri Jhanki Society Plot No 15, Ulwe, Navi Mumbai - 410206, Sector 21",Not Verified
"Lavish Family Spa & Salon in Ulwe, Mumbai",4.6,9,"Shop No 2 NMS Icon Building Plot No 194, Sector 19, Ulwe, Navi Mumbai - 410206, Near Krishna Child Care",Not Verified
"The Care Salon N Spa in Kopar Khairane, Mumbai",3.5,9,"Shop No. 6, Balaji Shriji Appartment. 13a, Sector 11, Kopar Khairane, Navi Mumbai - 400709, Behind Balaji Garden",Not Verified
"Hair Nuks in Kopar Khairane, Mumbai",4.0,6,"151, Sector 11, Hazihasan Miyapate Road, Kopar Khairane, Navi Mumbai - 400709",Not Verified
"Infinity Salon & Makeup Artist in Kopar Khairane, Mumbai",4.6,5,"Shop No -13 ,plot No -21/22 ,Ramchandra Niwas ChS, Sector-12A, Kopar Khairane, Navi Mumbai - 400709, Near Fam Society",Not Verified
"Alishas unisex Beauty Salon in Kopar Khairane, Mumbai",4.6,5,"Shop 13, Krishna Tower, Vashi road, Kopar Khairane, Navi Mumbai - 400709, near d mart, sector 15",Not Verified
"Savvys Beauty Salon in Kopar Khairane, Mumbai",3.3,4,"Shop No 10 & 15, Neel Vaibhav Chs, Sector 14, Kopar Khairane, Navi Mumbai - 400709, Opp Yashwant Rao Chauhan College, Near D Mart",Not Verified
"ahana salon & spa in Kamothe, Mumbai",5.0,3,"sector 20, near d mart, Kamothe, Navi Mumbai - 410206",Not Verified
"Trendy Beauty Salon & Spa in Seawoods, Mumbai",5.0,3,"Plot No 107, Shop No 1,2 & 5, Monarch Meadows, Seawoods, Navi Mumbai - 400706, Sector New 50",Not Verified
"Trendy Family Salon & Spa in Kopar Khairane, Mumbai",5.0,3,"Shop No 11, Shubham Building, Plot No. 77, Kopar Khairane, Navi Mumbai - 400709, Sector No 18, Near Kotak Mahindra Bank",Not Verified
"Cut De Crap in Kopar Khairane, Mumbai",4.8,3,"Shop No. 26, Fam C.H.S, Sector-11, Kopar Khairane, Navi Mumbai - 400709, Near FAM Society",Not Verified
"MK Salon in Kopar Khairane, Mumbai",4.8,3,"Shop No 04, Plot No 21, Classic Skylark, Kopar Khairane, Navi Mumbai - 400709, Sector 15, Near Indira Gandhi College",Not Verified
"Infinity Family Salon in Kopar Khairane, Mumbai",3.5,3,"Shop No.02, Plot No 14 Sector 16, Kopar Khairane, Navi Mumbai - 400709, Opposite Reliance Foundation",Not Verified
"Alluring Beauty Salon in Kopar Khairane, Mumbai",3.0,3,"Shop No 3, Plot No 21/22, Ramchandra Niwas, Sector 12, Kopar Khairane, Navi Mumbai - 400709, Opposite Kalash Udyan",Not Verified
"Alishas Unisex Beauty Salon in Kopar Khairane, Mumbai",5.0,2,"Shop No 13, Krishna Tower, Sector 14, Kopar Khairane, Navi Mumbai - 400709",Not Verified
"Alisha Beauty Salon in Kopar Khairane, Mumbai",4.5,2,"Shop No.13,Krishna Tower, Sector.14, Kopar Khairane, Navi Mumbai - 400709, Near D Mart",Not Verified
"Leeora Nature Care in Kopar Khairane Sector 14, Mumbai",4.0,2,"1A, Plot No-17, Krishna Tower, Kopar Khairane Sector 14, Navi Mumbai - 400709, Near D Mart",Not Verified
"New Hair Magic in Kopar Khairane, Mumbai",3.7,2,"Shop No. 4,Balaji Shriji, Sector 12, Kopar Khairane, Navi Mumbai - 400709, Opposite Balaji Garden",Not Verified
"Ozone Family Salon in Kopar Khairane Sector 11, Mumbai",2.5,2,"Fam society plot No 1919 shop no no 48, Kopar Khairane Sector 11, Navi Mumbai - 400709",Not Verified
"Pamper Me Ladies Salon in Kopar Khairane Sector 18, Mumbai",5.0,1,"Shop No 10, Shubham Building, Kopar Khairane Sector 18, Navi Mumbai - 400709, Near Gagangiri Hospital",Not Verified
